target,text
0,put parti 7 day week studi lightli think need draw custom checkbox know hardcor
1,congratul week competit draw u prize claim call 09050002311 b4280703 sm 18 150ppm
1,someon contact date servic enter phone fanci find call landlin 09111032124 pobox12n146tf150p
0,say god love amp need clean heart ten special peopl amp u c miracl tomorrow pl pl
0,hi kate even hope see tomorrow bit bloodi babyjontet txt back u xxx
0,tuition hm go 1120 1205 one mind
0,sure drive reach destin soon
0,serious tell exact word right
1,today voda number end 7548 select receiv 350 award match pleas call 08712300220 quot claim code 4041 standard rate app
0,k k watch film
0,yay better told 5 girl either
0,good even roger
0,anyth lor juz us lor
0,er yeah b sorri tell sit come wen u
1,text82228 get rington logo game question info
0,hello darlin ive finish colleg txt u finish u love kate xxx
0,feel like dick keep sleep text facebook messag sup town
0,need detail onlin job
1,import inform 4 orang user 0796xxxxxx today ur lucki day 2 find log onto http fantast prizeawait
0,sir wait call free pleas call
0,ju finish blow hair u finish dinner alreadi
0,great send account number
0,submit da project tmr rite
0,went ganesh dress shop
0,turn friend stay whole show wo back til lt gt feel free go ahead smoke lt gt worth
0,oh thkin goin yogasana 10 den nd go 3 den rush parco 4 nb oki lor u call readi
0,happi come noon
0,done mean
0,catch bu fri egg make tea eat mom left dinner feel love
0,sound better even im costum im sure time finish tomorrow txt end
0,coffe cake guess
0,dont open
0,bit ur smile hppnss drop ur tear sorrow part ur heart life heart like mine wil care u forevr goodfriend
0,fact clean show know upset prioriti constantli want
0,ju finish lunch way home lor tot u dun wan 2 stay sch today
0,ok tri week end cours coimbator
0,studi alon without anyon help cant need studi
0,hey babe sorri get sooner gari come fix caus think know go far ptbo say cost lt gt buck know might cheaper find someon second hand machin right let know want babe
0,ok found di pierr cardin one look normal cost 20 sale
0,g say never answer text
0,lol yeah point guess
0,prepar pleasur
0,wait lt gt min
0,enjoy shower possess pour u ur love one bcoz world lie golden gift love truli
0,dont think need yellow card uk travel ask someon gone lt gt buck
1,u meet ur dream partner soon ur career 2 flyng start 2 find free txt horo follow ur star sign horo ari
0,uncl boy need movi oh guid plu know torrent particularli legal system slow gr8 day plu start co dont meet onlin honey moon
0,wait 2 min stand bu stop
0,freez home yet rememb kiss mom morn love think miss yet
0,badrith chennai sure pick us competit
1,privat 2003 account statement 078
1,account credit 500 free text messag activ txt word credit 80488 cs
0,finish work yet
0,sure check happen around area
0,weightloss girl friend make load money ebay someth give thank god
0,ok what ur today plan
1,dear u invit xchat final attempt contact u txt chat 86688
0,new year eve went parti boyfriend si hey
0,head dey swell oh thank make day
0,send pic like
1,call freephon 0800 542 0578
0,oh think wi nz player unsold
0,hello littl parti anim thought buzz friend grin remind love send naughti ador kiss
0,fuck chicken messag would late woould buzz hear word
0,stop old man get build snowman snow angel snowbal fight
0,fine rememb
0,meet soon princess ttyl
1,urgent mobil 077xxx bonu caller prize 2nd attempt reach call 09066362206 asap box97n7qp 150ppm
0,alreadi one guy love
0,get hep b immunis nigeria
0,drop tank
0,let snow let snow kind weather bring ppl togeth friendship grow
0,like v shock leh co tell shuhui like tell leona also like dat almost know liao got ask abt ur reaction lor
1,ringtonek 84484
0,co want thing
0,dear sir salam pleasur meet today tea pleas send contact number save regard
0,good hear
0,real babi want bring inner tigress
1,link pictur sent also use http
0,
0,prob hon u doinat mo
1,award sipix digit camera call 09061221061 landlin deliveri within 28day cs box177 m221bp 2yr warranti 150ppm 16 p
0,go take babe
1,contact date servic someon know find call land line pobox45w2tg150p
0,shall fine avalarr hollalat
0,ok lor soni ericsson salesman ask shuhui say quit gd 2 use consid
0,good afternoon love goe day woke earli onlin wait hmmm italian boy onlin see grin
0,home lei
0,noe la u wana pei bf oso rite k lor day den
0,also didnt get na hi hi hi hi hi
0,mode men left
0,sir send group mail check
0,thinl role like stand other hit
0,husband
0,mean get door
0,lol boo hope laugh
0,aight chillin friend room text way
0,call
0,send print out da
0,murder coz man murder lt gt th januari public holiday close includ post offic understand
0,competit
0,anyth special
0,wish beauti day moment reveal even thing keep smile enjoy
0,send number give repli tomorrow morn said like ok
0,wo move morphin
0,scream mean shout
0,k must book huh go yoga basic sunday
0,oh got mani respons
0,nowher ikno doesdiscount
0,lol well without could big sale togeth
1,someon u know ask date servic 2 contact cant guess call 09058095107 reveal pobox 7 s3xi 150p
0,featheri bowa someth guy know
0,c movi juz last minut decis mah juz watch 2 lar tot interest
0,pain urin thing els
0,ahhh work vagu rememb feel like lol
0,morn ok
0,differ style
0,rememb hurt day satan impost pay price destini keep go u said pray get mind get
0,said would woke
0,yep great loxahatche xma tree burn lt gt start hour
0,offic what matter msg call break
0,awesom rememb last time got somebodi high first time diesel v
0,come slave go shell unconsci avoid make unhappi
0,call u finish come n pick u
1,chanc realiti fantasi show call 08707509020 20p per min ntt ltd po box 1327 croydon cr9 5wb 0870 nation rate call
0,know msg recent
0,understand loss gain work school
1,free top rington weekli 1st week subpoli 3 per
1,call 09094100151 use ur min call cast mob vari servic provid aom aom box61 m60 1er u stop age
0,hi email address chang
0,
0,told dr appt next week think gon na die told check noth worri listen
0,actual sleep still might u call back text gr8 rock si send u text wen wake
1,ur current 500 pound maxim ur send go 86688 cc 08718720201
0,free
0,forgot take 3 year shower sorri phone dead yet
0,pl wont beliv jesu
0,send naughti pix
0,garag key bookshelf
0,sorri dude dont know forgot even dan remind sorri hope guy fun
0,make babi yo tho
0,sorri mail
0,reason spoken year anyway great week best exam
0,grandma oh dear u still ill felt shit morn think hungov anoth night leav sat
0,two letter copi co one messag speak soon
1,dear voucher holder next meal us use follow link pc 2 enjoy 2 4 1 dine experiencehttp
0,lot sick thing go round take easi hope u feel better soon lol
0,ask dad pick lar ìï wan 2 stay 6 meh
0,hi move in2 pub would great 2 c u u cud come
0,first answer question
0,chang e one next escal
0,famili respond anyth room went home diwali one call come make feel like die
0,may call later pl
0,sir wait letter
0,id onluy matter get offcampu
0,nice wait text right gon na pay ticket ya know
0,yeah go bed back midnight
0,borrow ur bag ok
1,messag brought gmw connect
0,love decis feel could decid love life would much simpler less magic
0,tiim let hug break tear
0,yeah imma come caus jay want drug
0,hiya stu wot u much trubl home moment evon hate even u wot hell av done wont u tell text bck pleas luv dan
0,hello sort town alreadi dont rush home eat nacho let know eta
1,gr8 new servic live sex video chat mob see sexiest dirtiest girl live ur phone 4 detail text horni 89070 cancel send stop 89070
0,better made friday stuf like pig yesterday feel bleh least writh pain kind bleh
0,abeg make profit start use get sponsor next event
0,love brother time talk english grin say hey muhommad penni say hello across sea
0,ok also wan 2 watch e 9 pm show
0,poor babi hope urfeel bettersn luv probthat overdos work hey go care spk 2 u sn lot lovejen
0,night end anoth day morn come special way may smile like sunni ray leav worri blue blue bay
1,jamster get crazi frog sound poli text mad1 real text mad2 88888 6 crazi sound 3 c appli
0,want mapquest someth look dogwood
1,welcom pleas repli age gender begin 24m
0,horribl u eat mac eat u forgot abt alreadi rite u take long 2 repli thk toot b4 b prepar wat shall eat
0,hurt n meaning line ever compromis everyth love
0,got arrest possess shit lt time gt pm
0,work eye philosophi text u later bit free chat
0,watch live
0,nvm take ur time
0,get ten billion call text help god
0,go
0,ok ill tell compani
0,watch lor saw swatch one thk quit ard 116 need 2nd opinion leh
0,dnt wnt tlk wid u
0,heart empti without love mind empti without wisdom eye r empti without dream amp life empti without frnd alwi touch good night amp sweet dream
0,long quit get like 5 minut day
0,dare stupid wont tell anyth hear wont talk
0,happen adventur
0,dont want hear anyth
0,live next lt gt min
1,urgent tri contact today draw show prize guarante call 09050001808 land line claim m95 valid12hr
0,ryder gibb
0,ful song lyric
0,christma occas celebr reflect ur valu desir affect amp tradit ideal christma
0,remind get shall
0,yo yo yo byatch whassup
0,offic da
0,pl pl send mail know rel come deliv know cost risk benefit anyth els thank
1,sunshin hol claim ur med holiday send stamp self address envelop drink us uk po box 113 bray wicklow eir quiz start saturday unsub stop
0,think da wil
0,sea lay rock rock envelop envelop paper paper 3 word
0,yo gon na still stock tri get dubsack
0,one week leav put know time
0,yup still coffe wif fren fren drove give lift
0,ffffffffff alright way meet sooner
0,stop know well
0,today accept day u accept brother sister lover dear1 best1 clos1 lvblefrnd jstfrnd cutefrnd lifpartnr belovd swtheart bstfrnd rpli mean enemi
0,ow u paid told u would call
0,yun buy school got offer 2000 plu
0,give one miss number pleas
0,nimbomson yep phone know one obvious co that real word
0,aight grab someth eat text back mu
1,free entri 2 weekli comp chanc win ipod txt pod 80182 get entri std txt rate c appli 08452810073 detail
0,sent maga money yesterday oh
1,u r subscrib 2 textcomp 250 wkli comp 1st wk free question follow subsequ wk charg unsubscrib txt stop 2 84128 custcar 08712405020
0,r still meet 4 dinner tonight
0,feel like john lennon
1,orang bring rington time chart hero free hit week go rington pic wap stop receiv tip repli stop
0,say somebodi name tampa
1,thank subscript rington uk mobil charg pleas confirm repli ye repli charg
0,hmmm guess go 4 kb n power yoga haha dunno tahan power yoga anot thk got lo oso forgot liao
1,urgent mobil 07xxxxxxxxx bonu caller prize 2nd attempt reach call 09066362231 asap box97n7qp 150ppm
0,done
0,aight ill get fb coupl minut
0,new car hous parent new job hand
1,ur go 2 bahama callfreefon 08081560665 speak live oper claim either bahama cruis cash opt txt x 07786200117
0,time n smile r two crucial thing life sometim time make us forget smile sometim someon smile make us forget time gud noon
0,watch tv lor
0,happi babe woo hoo parti dude
1,lastest stereophon marley dizze racal libertin stroke win nookii game flirt click themob wap bookmark text wap 82468
1,upgrdcentr orang custom may claim free camera phone upgrad loyalti call 0207 153 offer end 26th juli c appli avail
0,die want u stuff
0,anyth lor
0,hope feel great pl fill abiola
0,hello hun ru way im good 2 date guy met walkabout far meet soon how everyon els
0,enter cabin pa said happi boss felt special askd 4 lunch lunch invit apart went
0,way home went chang batt 4 watch go shop bit lor
1,import messag final contact attempt import messag wait custom claim dept expir call 08717507382
0,never blame day ur life good day give u happi bad day give u experi essenti life god bless good morn
0,sure thing big man hockey elect 6 go longer hour though
0,err cud go 8pm got way contact
0,give sec think think
0,march end readi call sure problem capit never complet far work ladi
0,ju reach home go bath first si use net tell u finish k
0,rememb
0,dad back ph
0,x cours 2yr messag messeng lik r send
1,unsubscrib servic get ton sexi babe hunk straight phone go http subscript
0,gon na abl late notic home week anyway plan
0,tell dear happen talk like alian
0,thing r good thanx got exam march ive done revis fran still boyf ive got ta interviw 4 exet bit worri x
0,ring come guy costum gift futur yowif hint hint
0,multipli number independ count decim point divis push decim place like show
0,check got detail messag
0,real u get yo need 2 ticket one jacket done alreadi use multi
1,urgent mobil award bonu caller prize 2nd attempt contact call box95qu
0,good afternoon starshin boytoy crave yet ach fuck sip cappuccino miss babe teas kiss
0,mag meet avo point
1,08714712388 cost 10p
1,gent tri contact last weekend draw show prize guarante call claim code k52 valid 12hr 150ppm
0,gram usual run like lt gt half eighth smarter though get almost whole second gram lt gt
0,u tex mecaus u werebor yeah okden hunni r uin wk sat soundåõ likeyour havin gr8fun j keep updat countinlot lovem
0,said problem let know
0,sorri call later meet thing relat trade pleas call arul lt gt
0,sian aft meet supervisor got work 2 liao u work
0,parti alex nichol
0,hey tmr mayb meet yck
0,li hai bore da lectur repeat last week stuff wast time
0,babe hope shit night sleep fell asleep knacker iåõm dread work tonight thou upto tonight x
0,room
0,old orchard near univ
0,charg transfer charg withdraw anyhow like
0,hello beauti r u ok kinda ad row wiv walk pub want night wiv u miss u
0,guy bitch act like interest buy someth els next week gave us free
0,oh ye littl weather kind coccoon home
0,tell make littl spreadsheet track whose idea smoke determin entir month februari
0,meet darren
1,valu vodafon custom comput pick win prize collect easi call 09061743386
0,happi advanc
0,tension face smile face wast face innoc face face face face face face lt gt face
0,yup need ju wait 4 e rain 2 stop
1,thank 4 continu support question week enter u in2 draw 4 cash name new us presid txt an 80082
0,find way includ detail
1,goal arsen 4 henri 7 v liverpool 2 henri score simpl shot 6 yard pass bergkamp give arsen 2 goal margin 78 min
0,nope sinc ayo travel forgotten guy
0,u today
0,hello r u im bore inev thought id get bore tv tell someth excit happen anyth
0,want insid everi night
0,good sleep rhythm person establish rhythm bodi learn use want know
0,mean left earli check co work
0,know call
0,caus freaki lol
0,think u wrong number
0,doc prescrib morphin caus pain med enough wait mom bring med kick fast gon na tri later
0,make happi
0,valentin game send di msg ur friend 5 answer r someon realli love colour suit best
0,moment day bring hope afternoon bring faith even bring luv night bring rest wish u find morn
0,ye start send request make pain came back back bed doubl coin factori got ta cash nitro
1,text meet someon sexi today u find date even flirt join 4 10p repli name age eg sam 25 18 recd thirtyeight penc
0,way send shade stuff wonder
0,aight text address
0,mani day sinc
0,645
0,unless situat go gurl would appropri
0,current food alon also
1,babe u want dont u babi im nasti thing 4 filthyguy fanci rude time sexi bitch go slo n hard txt xxx slo 4msg
0,dear reliev westonzoyland go plan end
0,engalnd telli decid wo let watch mia elliot kiss damn
0,ok great thanx lot
0,got salt rub open wound like
0,wors use half way stop better complet
0,os call ubandu run without instal hard disk use os copi import file system give repair shop
0,wa u effici gee thanx
0,like italian food
0,like spoil
0,ye princess want pleas everi night wish command
0,suppos could make still town though
0,come karnan car pleas wait till 6pm directli goto doctor
0,hello wat talk email address
0,lt gt buck bank fee fix better call bank find
0,ok darlin supos ok worri film stuff mate babysit call
0,ìï say like dat dun buy ericsson oso oredi lar
0,anyway mani good even u
0,hey late ah meet
0,account number
0,send id password
0,great p diddi neighbor come toothpast everi morn
0,dont talk ever ok word
1,sale arsen dartboard good condit doubl trebl
0,dunno lei decid lor abt leona oop tot ben go n msg
0,ju an lar u noe later
0,kalli readi bat 2nd inning
0,havent add yet right
1,sm auction brand new nokia 7250 4 auction today auction free 2 join take part txt nokia 86021
0,raji pl favour pl convey birthday wish nimya pl today birthday
0,u wake alreadi thanx 4 e tau sar piah quit nice
0,4 taco 1 raja burrito right
0,hey happen de alright
0,yahoo boy bring perf legal
0,k k good go
0,much cost approx per month
0,pleas tell special stock talk
0,yeah fine get ok
0,site simul test give tough question test readi
0,hey gorgeou man work mobil number good one babe squishi mwah
0,u
0,havent plan buy later check alreadi lido got 530 show e afternoon u finish work alreadi
0,yo im right yo work
0,gener one uncount noun u dictionari piec research
0,let want hous 8am
0,ha ha pop loo hello
0,call unabl cal let meet bhaskar deep
0,except there chick huge boob
0,ok ok take care understand
0,much got clean
0,chang fb jaykwon thuglyf falconerf
0,hello peach cake tast lush
0,get threat sale execut shifad rais complaint offici messag
0,sever sir
1,join uk horniest dog servic u sex 2nite sign follow instruct txt entri 69888 150p
0,k call close
1,get 3 lion england tone repli lionm 4 mono lionp 4 poli 4 go 2 origin n best tone 3gbp network oper rate appli
0,jay want work first 4 sound
0,tell u headach want use 1 hour sick time
0,ill littl closer like bu stop street
0,gon na go get taco
1,hi custom loyalti offer new nokia6650 mobil txtauction txt word start 81151 get 4t ctxt tc
0,join today keep talk later
0,ok lor wat time finish
0,probabl still go stuff
0,ya srsli better yi tho
1,smsservic yourinclus text credit pl goto 3qxj9 unsubscrib stop extra charg help 9ae
1,hi babe jordan r u im home abroad lone text back u wan na chat xxsp text stop stopcost 150p 08712400603
0,howz pain hope u r fine
0,free call pa
0,kind took garag centr part exhaust need replac part order n take fix tomo morn
0,oh well c u later
1,u get 2 phone wan na chat 2 set meet call 09096102316 u cum 2moro luv jane xx
0,doctor 1tulsi cancer fat 1cup bone problm 3 litr diseas snd th 2 u care
0,motiv behind everi dark shine light wait find behind everi best friend alway trust love bslvyl
0,carlo say pick later yeah set
0,object bf come
0,ìï send content page
0,da cool iknow 2 wellda peril studentfinanci crisi spk 2 u
0,hey got mail
1,urgent 2nd attempt contact u u call 09071512433 b4 050703 csbcm4235wc1n3xx callcost 150ppm mobilesvari 50
0,dled 3d imp
0,honey boo miss u
0,also tell said happi birthday
0,yup havent want go yoga call book
0,nite
0,mmmm fuck fair know weak grin push knee expos belli pull head forget know wick smile
0,fuck babe miss alreadi know ca let send money toward net need want crave
0,sri da jst nw came home
0,ok lor buy wat
0,dont know come ask question like dont mistak
0,guy ask get slipper gone last year
0,well imma definit need restock thanksgiv let know
0,may b approv panalam post
0,arun u transfr amt
0,b4 thursday
0,back brum thank put us keep us happi see soon
0,word chess come persian phrase shah mean king dead goodmorn good day
0,beauti tomorrow never come come alreadi today hunt beauti tomorrow wast wonder today goodmorn
0,k k pa lunch aha
1,privat 2003 account statement show 800 point call 08718738002 identifi code 48922 expir
0,babe fuck love know fuck good hear voic need crave ca get enough ador ahmad kiss
0,special
0,hey babe friend cancel still visit
0,fine got enough bud last night least
0,way
0,time come
0,n funni
1,congratul thank good friend u xma prize 2 claim easi call 08718726971 10p per minut
0,good trip watch rememb get back must decid easter
0,watch tv lor nice one like lor
0,final readi fyi
0,haf u eaten wat time u wan 2 come
0,hey sweet wonder moment might come want send file someon wo go yahoo connect suck rememb set page go download format disc could tell know way download big file download stuff directli internet help would great prey teas kiss
1,good luck draw take place 28th feb good luck remov send stop 87239 custom servic 08708034412
0,come home want u miser
0,fine difficulti phone work mine pl send anoth friend request
0,hi babi ive got back work want see u allday hope didnt piss u phone today u give call xxx
1,splashmobil choos 1000 gr8 tone wk subscrit servic weekli tone cost 300p u one credit kick back enjoy
0,hey thk juz go accordin wat discuss yest lor except kb sun co nt much lesson go attend kb sat
0,norm tomorrow finish co st test need sort librari stuff point tomo got letter today access til end march better get move
0,ìï v fan
0,k k also fine complet cours
0,know rape dude poker
0,know grumpi old peopl mom like better lie alway one play joke
0,hi shanil rakhesh exchang uncut diamond back excel servic dino prem
0,sorri call later lt gt min
0,broke list reason nobodi town ca tell sarcast faggi
0,er hello thing quit go plan limp slowli home follow aa exhaust hang
0,hiya how go sunni africa hope u r avin good time give big old silver back big kiss
0,everi night take warm bath drink cup milk see work magic still need loos weight know
0,alreadi sabarish ask go
0,dunno wat get 4
0,tomorrow go theatr come wherev u call tell come tomorrow
1,5 free top polyphon tone call 087018728737 nation rate get toppoli tune sent everi week text subpoli 81618 per pole unsub 08718727870
1,privat 2004 account statement 07742676969 show 786 unredeem bonu point claim call 08719180248 identifi code 45239 expir
0,anyway think secur anyth lem know want drive south chill
0,home
0,go bed prin
0,goodmorn today late lt decim gt min
0,ju came back fr lunch wif si u leh
0,sorri uncl keep touch
0,good thing get connect bw
0,last thing ever want hurt think would laugh embarass delet tag keep go far knew even fact even felt like would hurt show realli know messi wednesday bad problem time clean choos skype take pictur sleep want go mind thing make bed throw laundri top ca friend hous embarass underwear bra strewn bed pillow floor someth els use good least make bed
0,huh earli dinner outsid izzit
0,hav almost reach call unabl connect u
0,gone get info bt dont know
1,summer final fanci chat flirt sexi singl yr area get match repli summer free 2 join optout txt stop help08714742804
0,r go lt gt bu
0,u get pic msg phone
1,urgent mobil number bonu caller prize 2nd attempt reach call 09066368753 asap box 97n7qp 150ppm
0,ok take
1,xma offer latest motorola sonyericsson nokia free bluetooth dvd doubl min 1000 txt orang call mobileupd8 08000839402
0,ran younger man make pretti babi togeth
0,dont much imag class
0,dunno close oredi ìï v fan
0,worri though understand import put place poorli thought punish face worst thing ever happen brb gon na go kill
0,gobi art colleg
0,u ned convinc tht possibl witot hurt feel main
0,ok omw castor
0,da run activ full version da
0,shall bring us bottl wine keep us amus joke bring one anyway
0,ye think offic lap room think that last day didnt shut
0,singl line big mean anyth 4 ur best
0,nt yet chikku simpl habba hw abt u
0,ga station like block away hous drive right sinc armenia end swann take howard
0,hey told name gautham ah
0,speak cash yet
1,hear new come ken stuff
0,noe da car later c lar wear short
0,bishan lar nearer need buy earli co buy got ta park car
0,call da wait call
0,well keep mind got enough ga one round trip bar sudden influx cash
0,love set soul fire spark flame big rawr flame xoxo
0,cool lt gt inch long hope like big
1,back 2 work 2morro half term u c 2nite 4 sexi passion b4 2 go back chat 09099726481 luv dena call
0,realli hope work doesnt get stress gr8 day
0,know anthoni bring money school fee pay rent stuff like that need help friend need
0,havent stuck orchard dad car go 4 dinner u leh r free tonight
0,thatåõ alrit girl u know gail neva wrong take care sweet donåõt u l8tr hun love yaxxx
0,rat hey u ever vote next theme
0,goodnight sleep well da pleas take care pleas
0,ok call mom instead fun
0,minor shindig place later tonight interest
0,ye saw messag
0,u r beauti girl ive ever seen u r babi come c common room
1,guarante 32000 award mayb even cash claim ur award call free 0800 legitimat efreefon number wat u think
0,late need go n get da laptop
0,boy late 2 home father
0,ye da plm ur offic
0,big god bring success
0,sac need carri
0,ok
0,simpli sit watch match offic
0,heard week
1,urgent tri contact today draw show prize guarante call 09058094507 land line claim valid 12hr
0,make 3 4 fuck sake x
0,jay told alreadi
0,thk u dun haf 2 hint e forum alreadi lor co told ron n darren go 2 tell shuhui
0,onlyfound afew day
0,bill letter expect one orang bill may still say orang
0,nope wait sch 4 daddi
1,decemb mobil entitl updat latest colour camera mobil free call mobil updat co free 08002986906
0,one talk
0,said bad dat e gal know u wat u
0,lei
0,good let thank god pleas complet drug lot water beauti day
0,mmm fuck merri christma
0,great shoot big load get readi
0,age abj
0,pleas reserv ticket saturday eve chennai thirunelvali tirunelvali chennai sunday eve alreadi see net ticket avail want book ticket tackl
0,u gd lor go shop got stuff u wan 2 watch infern affair come lar
0,sure dont forgot come alway touch
0,hey sexi bun told ador loverboy hope rememb thank sister law meatbal grin love babe
1,free nokia motorola upto 12mth linerent 500 free min free call mobileupd8 08001950382 call
0,cab pick drop door step
0,ca believ attach see everi day know best get babe go teach class midnight
0,sent price mean lt gt g
0,huh 6 also mani mistak
0,want go
1,would like see xxx pic hot nearli ban uk
0,place man
0,use hope agent drop sinc book thing year whole boston nyc experi
1,09066362231 urgent mobil 07xxxxxxxxx bonu caller prize 2nd attempt reach call 09066362231 asap
0,also hi wesley
0,hi petey noiåõm ok want 2 chat coz avent spoken 2 u 4 long ur doin good nit js love ya
0,sorri complet forgot pop em round week still
0,wat late still earli mah juz go 4 dinner lor aiya dunno
0,boytoy miss happen
