target,text
0,mum went 2 dentist
0,well go aunti
0,test earlier appreci call tomorrow
1,07732584351 rodger burn msg tri call repli sm free nokia mobil free camcord pleas call 08000930705 deliveri tomorrow
0,co daddi arrang time c wat time fetch mah
1,free2day sexi st georg day pic jordan txt pic 89080 dont miss everi wk sauci celeb 4 pic c 0870241182716
0,joy father john john name joy father mandan
0,want grasp pretti booti
0,seen facebook huh lol
0,lt gt pple marri lover becz hav gud undrstndng dat avoid problem sent di 2 u u wil get gud news friday person like tomorrow best day life dont break chain break suffer send lt gt frnd lt gt min whn u read
0,still check da
0,ask say pleas messag
0,thankyou much call appreci care
1,88066 88066 lost 3pound help
0,boy love u grl hogolo boy gold chain kodstini grl agalla boy necklac madstini grl agalla boy hogli 1 mutai eerulli kodthini grl love u kano
0,thanx4 today cer nice 2 catch ave 2 find time often oh well take care c u
0,good make money
0,come mu sort narcot situat
0,updat face book statu frequent
0,long applebe fuck take
1,contact date servic someon know find call mobil landlin 09064017305 pobox75ldns7
0,thread wishlist section forum ppl post nitro request start last page collect bottom
0,meet corpor st outsid gap see mind work
0,good need done ye pleas tell number could ring
0,prof pass paper sem congrat student enna kalaachutaarama prof gud mrng
0,pattern recent crap weekend
0,ya nice readi thursday
0,hope thing went well remind still need u c littl thing left loung
0,u sleep go take haha got spi wat onlin check n repli mail lor
0,pick ur fone u dumb
0,sure night menu know noon menu
0,even cant close eye vava play umma
0,quit lor dun tell wait get complac
0,pleas ask mummi call father
0,pl send correct name da
0,usual u call ard 10 smth
0,check
0,pl give food prefer pap slowli load sugar take hour give water slowli
0,get worri derek taylor alreadi assum worst
0,u mean u almost done done wif sleep tot u go take nap yup send liao pick ard 4 smth lor
0,hey rite u put åè10 evey mnth
0,ok lor earli still project meet
0,hello per request lt gt transfer
0,eaten day sit stare juici pizza ca eat med ruin life
0,ok leav need ask
0,late said websit dont slipper
0,town ju take mrt later
0,want kiss feel next
0,first time everyth
0,go tri 2 month ha ha joke
0,lt decim gt common car better buy china asia find less expens holla
0,awesom lem know whenev around
0,meant apolog text get drug lt gt night
1,someonon know tri contact via date servic find could call mobil landlin 09064015307 box334sk38ch
0,murder coz man murder lt gt th januari public holiday close includ post offic
0,hope would send messag rent due dont enough reserv complet gone loan need hope could balanc lt gt way could get till mid march hope pay back
0,see
0,u sick still go shop
0,hope settl new school year wishin gr8 day
0,opposit side drop
0,might come kerala 2 prepar take leav finalis plan travel finish urgent work
0,u ever get song stuck head reason wo go away til u listen like 5 time
0,could kiss feel next
0,omg one thing anoth cat worm bad day end
0,know result
0,smoke peopl use smoke justifi ruin shit
0,tonight mate catch sleep new number way
1,congratul ur award either yr suppli cd virgin record mysteri gift guarante call 09061104283 ts cs approx 3min
0,moon come color dream star make music sm give warm peac sleep good night
0,mean fat head
0,still mayb leav credit card get ga get back like told
0,also thk fast xy suggest one u dun wan go 2 rain leh got gd
0,sat right okay thank
0,sorri man account dri would want could trade back half could buy shit credit card
0,derp wors dude alway want parti dude file complaint three drug abus live
0,ha know either clever simpl thing pear day perfect christma
0,ca give everyth want need actual could better yor got money ca get work ca get man ca pay rent ca even fill fuck ga tank ye stress depress even call home thanksgiv cuz tell noth
0,yup wun believ wat u realli neva c e msg sent shuhui
0,home
0,taught ranjith sir call sm like becau he verifi project prabu told today pa dont mistak
1,urgent mobil number award prize guarante call 09061790121 land line claim valid 12hr 150ppm
1,text pass 69669 collect polyphon rington normal gpr charg appli enjoy tone
0,hey ad crap nite borin without ya 2 boggi u bore biatch thanx u wait til nxt time il ave ya
0,arngd marriag u r walkin unfortuntli snake bite bt love marriag danc frnt snake amp sayin bite bite
1,rcv msg chat svc free hardcor servic text go 69988 u get noth u must age verifi yr network tri
0,ok good later come find c lucki told go earlier later pple take finish
0,whenevr ur sad whenevr ur gray remembr im 2 listn 2 watevr u wan na say ju walk wid littl amp promis bring back ur smile
0,ok let noe later n ask call u tmr
0,usual person unconsci children adult may behav abnorm call
0,text way cup stop work bu
1,gent tri contact last weekend draw show prize guarante call claim code k52 valid 12hr 150ppm
0,hi elain today meet confirm
0,wow healthi old airport rd lor cant thk anyth els b bath dog later
1,ask 3mobil 0870 chatlin inclu free min india cust serv sed ye l8er got mega bill 3 dont giv shit bailiff due day 3 want
0,drama enough famili struggl hot sun strang reason ego go invit actual necess seriou reppurcuss
0,like new hous
0,work technic support voic process
0,ai answerin phone actual pretti reason hour sleepi
1,25p 4 alfi moon children need song ur mob tell ur m8 txt tone chariti 8007 nokia poli chariti poli zed 08701417012 profit 2 chariti
0,hmm dunno leh mayb bag 4 goigng dat small ju anyth except perfum smth dat keep
0,told number gautham
0,that cool like photo sexi
1,gr8 poli tone 4 mob direct 2u rpli poli titl 8007 eg poli breathe1 titl crazyin sleepingwith finest ymca pobox365o4w45wq 300p
0,yet chikku go room nw bu
0,u call
0,come lt gt min
0,dunno da next show aft 6 toa payoh got 650
0,lol wo feel bad use money take steak dinner
0,dear friend sorri late inform today birthday love detail log face book see number lt gt dont miss delici treat
0,u realli pig leh sleep much dad wake 10 smth 2 eat lunch today
0,nice day today love dearli
0,dare ask luck sort car
0,v romant
0,network technic support associ
0,that cool princess cover face hot sticki cum
0,tell friend plan valentin day lt url gt
0,gud mrng dear hav nice day
0,thing ape u fight death keep someth minut u let go that
1,wan na get laid 2nite want real dog locat sent direct ur mobil join uk largest dog network txt park 69696 nyt ec2a 3lp
0,thank love rock
0,mysteri solv open email sent anoth batch sweeti
0,didnt get anyth da
0,reassur crazi world
0,ok dear call chechi
1,sppok ur mob halloween collect nokia logo pic messag plu free eeri tone txt card spook 8007
0,alright sure let know leav
0,plz tell an bslvyl sent via
0,oga left phone home saw ur messag hope good great weekend
0,work
0,wen u finish fanci meetin wiv u tonit need break dabook 4 hr last today wrk
0,hard believ thing like say lie think twice say anyth
0,tell bad charact u dnt lik tri chang lt gt add tat 2 new year resolut wait ur frank good morn
0,piti mood suggest
0,thank meet monday
0,anyth lor toa payoh got place 2 walk meh
0,found way get anoth app phone eh go net cafe take job geeee need babe crave see
0,life spend someon lifetim may meaningless moment spent someon realli love mean life
1,want 2 get laid tonight want real dog locat sent direct 2 ur mob join uk largest dog network txting moan 69888nyt ec2a 150p
0,liter bed like lt gt hour
0,aww first time u said u miss without ask miss u first love
0,alrit
0,honestli made love cup tea promptli drop key burnt finger get
0,arriv see coupl day lt 3
0,yet like keep touch easiest way barcelona way ru hous
0,thx well month
0,didnt holla
0,wat time liao still got
0,moji love word rich day
0,keep away like
0,lem know swing pick free basic time 1 semest
0,u
0,8 min go lunch
0,kate love see tonight ill phone tomorrow got sing guy gave card
1,xma offer latest motorola sonyericsson nokia free bluetooth doubl min 1000 txt orang call mobileupd8 08000839402
0,practis curtsey
0,went fast asleep care
0,hey mr go sea view coupl gay mean game give bell ya finish
0,noth ok anyway give treat
0,hmm yeah groov im look forward pound special
1,winner valu network custom hvae select receiv reward collect call valid 24 hour acl03530150pm
0,buy pizza meat lover suprem u get pick
0,eye philosophi
0,realli good dhanush rock
0,goodmorn today late lt gt min
0,tell shola pleas go colleg medicin visit academ depart tell academ secretari current situat ask transfer ask someon check sagamu thing lautech vital complet medic educ nigeria less expens much less expens unless get citizen rate new zealand
0,babe back come back
0,lift hope offer money need especi end month approach hurt studi anyway gr8 weekend
0,think chennai well settl
1,new textbuddi chat 2 horni guy ur area 4 25p free 2 receiv search postcod txt one name 89693 08715500022 rpl stop 2 cnl
0,still custom place
0,ya even cooki jelli
0,piggi r u awak bet u still sleep go 4 lunch
0,dai lt gt naal eruku
0,k da mani page want
0,oh charg camera
0,erm ill pick give enough time get park
0,omg joanna freak look thru friend find photo ask stuff myspac even log like year
0,got c lazi type forgot lect saw pouch like v nice
0,promis though even gotten dinner yet
0,take mokka player
0,hit move
0,great princess love give receiv oral doggi style fave posit enjoy make love lt gt time per night
0,hi home calicut
1,pleas call custom servic repres freephon 0808 145 4742 guarante cash prize
0,nah straight bring bud drink someth actual littl use straight cash
0,haha okay today weekend leh
0,alright set text man
0,thank much skype wit kz sura didnt get pleasur compani hope good given ultimatum oh countin aburo enjoy messag sent day ago
0,abl kid want kid one day
0,fair enough anyth go
0,darren say dat u meet da ge den dun meet 4 dinner co later u leav xy feel awkward den u meet 4 lunch lor
0,hey next sun 1030 basic yoga cours bugi go pilat intro next sat tell time r free
0,alright hook guy
0,two fundament cool life
0,k k much cost
1,miss call alert number call left messag 07008009200
0,dint come us
0,need go get
1,ye place town meet excit adult singl uk txt chat 86688
1,valentin day special win quiz take partner trip lifetim send go 83600 rcvd
0,ye post coupl pic fb still snow outsid wake
0,sure get acknowledg astoundingli tactless gener faggi demand blood oath fo
0,happen yo date
0,donno gene someth
0,number vivek
1,win year suppli cd 4 store ur choic worth enter weekli draw txt music 87066 ts cs
0,eh sorri leh din c ur msg sad alreadi lar watch tv u still offic
0,want send virtual hug need one
0,nope b go 2 sch fri quit earli lor co my si got paper da morn
0,gon na rip uteru
0,want send someth sell fast lt gt k easi money
1,1 nokia tone 4 ur mob everi week txt nok 87021 1st tone free get txtin tell ur friend 16 repli hl 4info
0,comput fri essenti part keep spare fuck idiot roommat looovvv leav thing run full lt gt
0,check error difficulti correct
0,babe goe day miss alreadi love love kiss hope everyth goe well
0,awesom gon na soon later tonight
0,see letter b car
0,hey inconveni si huh
1,talk sexi make new friend fall love world discreet text date servic text vip 83110 see could meet
0,got hella ga money want go grand natur adventur galileo littl bit
0,pussi perfect
0,ok tell half hr b4 u come need 2 prepar
0,thought bout drink tap spile seven pub ga st broad st canal ok
0,haha awesom might need take doin tonight
1,tell u 2 call 09066358152 claim prize u 2 enter ur mobil person detail prompt care
0,call like lt gt time oh give us hypertens oh
1,sm auction nokia 7250i get win free auction take part send nokia 86021
0,exhaust train morn much wine pie sleep well
1,free entri weekli comp send word win 80086 18 c
0,ok thk got u wan 2 come wat
0,mani time lose best one bcoz
0,huh got lesson 4 lei n thinkin go sch earlier n tot parkin kent vale
0,good morn im suffer fever dysentri abl come offic today
0,much bad avoid like
0,wish great semest
0,tell drug dealer get impati
1,u subscrib best mobil content servic uk per ten day send stop helplin 08706091795
0,din tell u ju 420
0,back lem know readi
0,aight sound good want come
1,2nd attempt contract u week top prize either cash prize call 09066361921
0,check realli miss see jeremiah great month
0,ha must walk everywher take tram cousin said walk vic market hotel
0,oh shut omg yesterday dream 2 kid boy piss kid boy even told mark dream chang diaper caus get owe face
0,lmao fun
0,u call alter 11 ok
0,dont know support ass srt thnk think ps3 play usb
0,ic lotta childporn car
0,got outta class gon na go gym
0,fret buy ovul test strip send wont get til like march send postal
0,water log desert geoenvironment implic
0,get back time soon
0,come mahal bu stop lt decim gt
0,head straight
1,pleas call 08712402578 immedi urgent messag wait
0,great church holla get
0,lol ok forgiven
0,call cost guess isnt bad miss ya need ya want ya love ya
0,said went back bed ca sleep anyth
0,howz person stori
0,hi engag fixd lt gt th next month know realli shock bt hmm njan vilikkam ws al sudn
0,sure mean
0,aight tomorrow around lt gt
0,ìï give time walk
0,u come funer home
0,u come n search tat vid finishd
0,rememb ask alex pizza
0,jay snicker tell x total fuck chord speak
0,get 3 unless guy want come time sooner
0,need coffe run tomo ca believ time week alreadi
0,yup izzit still rain heavili co e mrt ca c outsid
0,oh shit thought trip loooooool make much sens grin sofa refer link sent went trip oh babe go celebr rent
0,yetund sorri moji seem busi abl go shop pleas find way get want us get pleas forgiv repli free via yahoo messeng
0,sorri sir call tomorrow
0,hi babe u r like bed im sorri tonight realli wan na see u tomorrow call love xxx
0,dont give monkey wot think certainli mind friend mine sleep wiv wud annoyin
0,go take bath ill place key window
0,come sec somebodi want see
0,haha think
1,hi mandi sullivan call hotmix fm chosen receiv easter prize draw pleas telephon 09041940223 claim prize transfer someon els
0,thank love wish rock
0,ard 4 lor
0,congrat kano whr treat maga
0,buzzzz grin buzz ass buzz chest buzz cock keep phone vibrat feel shake
1,ur chanc win wkli shop spree txt shop c custcar 08715705022
0,danc river
0,u sure u ca take sick time
0,u noe 2 send file 2 comput
0,problem babi good time talk call left messag
0,good weekend
1,free 1st week no1 nokia tone 4 ur mobil everi week txt nokia 8077 get txting tell ur mate pobox 36504 w45wq
0,k give kvb acc detail
0,26th juli
0,goodnight da thangam realli miss u dear
0,ofcours also upload song
0,horribl gal sch stuff come u got mc
0,lol need cash nitro hurri come crash
0,eatin lor goin back work soon e mountain deer show huh watch b4 liao nice
1,tri call repli sm video mobil 750 min unlimit text free camcord repli call 08000930705 del thur
0,mm food da
0,oh realli perform write paper go movi home midnight huh
0,gon na let know co come bak holiday day come number
0,free today haf 2 pick parent tonit
0,ride equal unev mani peski cyclist around time night
0,tabl occupi wait tree
0,ok take ur time n enjoy ur dinner
0,farm open
0,finish 6
0,spend new year brother famili let plan meet next week readi spoil
0,bring tat cd forget
0,nope meanwhil talk say make greet
0,thank pick trash
0,gon na pick 1 burger way home ca even move pain kill
1,u secret admir look 2 make contact r reveal think ur 09058094594
0,check audrey statu right
0,love wine dine ladi
0,antha num corrct dane
0,right think
0,ok way railway
0,thank bomb date phone want say
0,ah well confus thing doesnt thought friend mayb wrong thing alreadi sort invit may come co money
0,issu right ill fix tomorrow
0,first strike red one bird antelop begin toplay fieldof selfindepend believ flower content
0,yo watch movi netflix
0,hi happi new year dont mean intrud pl let know much tuition paid last semest much semest thank
0,see film
1,urgent pleas call 09061743811 landlin abta complimentari 4 tenerif holiday cash await collect sae cs box 326 cw25wx 150ppm
0,yup finish c
0,mani time told stage use laugh listen aha
0,ugh ca u apolog admit u wrong ask take u back
1,urgent mobil award bonu caller prize final attempt 2 contact u call 08714714011
0,know watch film comput
0,aight text tonight see
0,ok msg u b4 leav hous
0,dude sux snake got old raiden got buff
0,sweetheart hope kind day one load reason smile biola
0,network job
0,hello love goe day wish well fine babe hope find job prospect miss boytoy teas kiss
0,nah ca help never iphon
0,mayb say hi find got card great escap wetherspoon
1,dear matthew pleas call 09063440451 landlin complimentari 4 lux tenerif holiday cash await collect ppm150 sae cs box334 sk38xh
0,neva grumbl sad lor hee buy tmr lor aft lunch still meetin 4 lunch tmr neva hear fr lei ìï got lot work ar
0,evo download flash jealou
0,gentleman treat digniti respect
0,yuou work get pc mom find spot would work need
0,promis get soon text morn let know made ok
0,calm downon theacus itxt u co iwana know wotu r doin haventcn u age ring ur up4 neth j
0,ok lor u wan go look 4 u
1,ree entri 2 weekli comp chanc win ipod txt pod 80182 get entri std txt rate c appli 08452810073 detail
0,hi yiju meet u 11 tmr
0,friend got say up order gram got lt gt get
0,sari need tim bollox hurt lot tol
0,seriou money base
0,take italian food pretti dress panti
0,wont get concentr dear know mind everyth
0,nokia phone lovli
0,problem walk around oblivi go around say thing constantli go one ear go whatev want know upset listen tell go upset want surpris mad
0,nvm ok
0,come medic colleg 7pm forward da
0,remind hr
0,omw back tampa west palm hear happen
1,ur current 500 pound maxim ur send cash 86688 cc 08718720201 po box
0,dun believ leh tot told true alreadi thk muz c us tog believ
0,fuck babe happen come never came back
0,much ur hdd case cost
0,way meet mountain dont
0,hellogorg how u fone charg lst nitw wen u texd hopeu ad nice wkend im sure u lookin 4ward 2 u 2mrw luv jaz
0,lol nah bad thank good b home quit realiti check how ur day u anyth websit
0,allo brave buse taken train triumph mean jolli good rest week
0,stand away heart ach without wonder crave
1,5p 4 alfi moon children need song ur mob tell ur m8 txt tone chariti 8007 nokia poli chariti poli zed 08701417012 profit 2 chariti
0,love come took long leav zaher got word ym happi see sad left miss
0,chinatown got porridg claypot rice yam cake fishhead beehoon either eat cheap den go cafe n tok go nydc somethin
0,hey go quit soon xuhui work till end month
1,1 new voicemail pleas call 08719181503
1,ur tonex subscript renew charg choos 10 poli month bill msg
0,k sure consent form v
0,k give back thank
0,ìï write wat
0,hello boytoy geeee miss alreadi woke wish bed cuddl love
0,hope result consist intellig kind start ask practicum link keep ear open best ttyl
0,140 ard ìä rest ard 180 least price 4 2 bedrm 900
0,oic co n si got lunch today dad went dunno whether 2 eat sch wat
0,k wat tht incid
0,thanx 4 e browni v nice
1,1 new messag pleas call 08715205273
0,signific
0,think wast rr
0,tell friend come round til like lt gt ish
0,thank tesco quit nice gone speak soon
0,lol real told dad cancer
0,well gon na finish bath good fine night
0,go lunch
0,well great weekend
0,watch ajith film ah
0,stop howev suggest stay someon abl give or everi stool
0,noth much chillin home super bowl plan
0,thk got ta go home urself co b go shop 4 fren present
0,prakesh know
0,probabl gon na swing wee bit
0,goodmorn grandfath expir leav today
0,aiyah sorri lor watch tv watch forgot 2 check phone
0,also fuck famili go rhode island wherev fuck leav alon week new bong gt
1,mobil number claim call us back ring claim hot line 09050005321
0,sir wait mail
0,number u live 11
0,even brother like speak treat like aid patent
0,camera quit good pixel 3optic 5digit doom love holiday safe hope hav good journey happi new year see coupl week
1,urgent import inform o2 user today lucki day 2 find log onto http fantast surpris await
0,xy go 4 e lunch
0,time want come
0,releas anoth italian one today cosign option
0,hi chachi tri call u unabl reach u pl give miss cal u c tiz msg kanagu
0,search right word thank breather promis wont take help grant fulfil promis wonder bless time
0,yup studi surf lor e lazi mode today
0,hair cream ship
0,fyi usf swing room whenev
0,sez how u de arab boy hope u r good give love 2 evry1 love ya eshxxxxxxxxxxx
1,refus loan secur unsecur ca get credit call free 0800 195 6669 text back
0,late call tomorrow care sweet dream u ummifi bye
0,ok lor ned 2 go toa payoh 4 2 return smth u wan 2 send wat
0,told return order
0,sure result offer
0,take phone callon friday assum wo year
1,free game get rayman golf 4 free o2 game arcad 1st get ur game set repli post save activ8 press 0 key arcad termsappli
0,free day finish 6 mon n thur
0,dun need use dial juz open da browser n surf
1,tri contact repli offer 750 min 150 textand new video phone call 08002988890 repli free deliveri tomorrow
1,tri call repli sm video mobil 750 min unlimit text free camcord repli call 08000930705
1,bin award play 4 instant cash call 08715203028 claim everi 9th player win min optout 08718727870
0,ya tel wat ur problem
0,lol great im get hungri
0,pleas attend phone
0,tonight yeah
0,ok wont call disturb one know avoid burden
0,see finish load loan pay
0,way tirupur
0,ew one
0,sit mu wait everyon get suit take shower
1,sm ac blind date 4u rodds1 aberdeen unit kingdom check http sm blind date send hide
0,gorgeou keep pix cum thank
0,hear
0,ca number
1,guarante cash prize claim yr prize call custom servic repres 08714712379 cost 10p
0,pizza u want
0,pleas leav topic sorri tell
0,puriti friendship two smile read forward messag smile see name gud evng musthu
0,also know lunch menu da know
0,love work home
0,cutest girl world
0,bognor splendid time year
1,thank rington order ref number r836 mobil charg tone arriv pleas call custom servic 09065069154
1,get touch folk wait compani txt back name age opt enjoy commun
1,b floppi b snappi happi gay chat servic photo upload call 08718730666 2 stop text call 08712460324
0,think spatula hand
0,hi pleas get lt gt dollar loan pay back mid februari pl
0,film ill call later
1,2p per min call germani 08448350055 bt line 2p per min check info c text stop opt
0,hi darlin work u get troubl ijust talk mum morn realli good time last night im goin soon call u
0,sorri brah finish last exam
0,road cant txt
0,hi da today class
1,email alertfrom jeri stewarts 2kbsubject prescripiton drvgsto listen email call 123
0,reach home tire come tomorro
0,hey r still onlin finish format
0,wan earli lei outsid wun b home earli neva mind
0,tunji queen wish great day abiola
0,dont file bag work call tell find anyth room
0,jay get realli impati belliger
0,got room soon put clock back til 8 shout everyon get realis wahay anoth hour bed
0,hello news job make wait fifth week yeah im woozl weasel exet still home 3
0,prashanthettan mother pass away last night pray famili
0,lt gt w jetton ave forgot
0,custom place wil cal u sir
0,make lasagna vodka
0,wait know wesley town bet hella drug
0,let know contact settl room let know ok
0,sent send
0,world suffer lot violenc bad peopl silenc good peopl
0,lol u trust
0,plan
1,money r lucki winner 2 claim prize text money 2 88600 give away text rate box403 w1t1ji
0,sure sinc parent work tuesday realli need cover stori
0,think tantrum finish yeah point
0,yeah still give ride
0,1 thing chang sentenc want 2 concentr educ career im leav
0,2mro come gym machan goodnight
0,tell someth that okay
0,rush work school rush go hungri
0,design softwar develop may get chennai
0,eh ur laptop got stock lei say mon muz come take look c got
0,mm feel sleepi today shall get dear
0,hi durban still number
0,love night wake see messag hope smile know great morn
0,beauti sleep help ur pimpl
0,think rule tamilnadu tough peopl
0,hi darlin finish 3 u 1 2 pick meet text back number luv kate xxx
0,need come home give good lovin
1,ou guarante latest nokia phone 40gb ipod mp3 player prize txt word collect 83355 ibhltd ldnw15h
0,esplanad lor els
0,wake sinc check stuff saw true avail space pl call embassi send mail
0,new deu ex game comin earli next yr
0,hi darlin im way london smash anoth driver big dent im realli miss u u xxx
0,well like actual call someon punto woulda wors
0,u still paint ur wall
0,think steyn sure get one wicket
0,sure see come bit
0,mean got epi fine
0,didnt work oh ok goodnight fix readi time wake dearli miss good night sleep
0,nothin come mind ìï help buy hanger lor ur laptop heavi
0,youdo later sar
0,aiyar dun disturb u liao thk u lot 2 aft ur cupboard come
1,receiv week tripl echo rington shortli enjoy
0,geeeee love much bare stand
0,u find sitter kaitlyn sick slept day yesterday
1,hi ur lookin 4 sauci daytim fun wiv busti marri woman free next week chat 2 sort time 09099726429 janinexx
1,free msg bill mobil number mistak shortcod call 08081263000 charg call free bt landlin
0,how favourit person today r u workin hard could sleep last nite nearli rang u
0,poor girl ca go one day lmao
0,comingdown later
0,got ur favorit oyster n got favorit sashimi ok lar dun say alreadi wait ur stomach start rumbl
0,up 3day also ship compani take 2wk way usp take week get lag may bribe nipost get stuff
0,u guy never invit anywher
0,wan na watch movi
0,would good phone tomo lunchtim shall organis someth
0,tirupur call da
0,miss vday parachut doubl coin u must know well
1,new mobil 2004 must go txt nokia 89545 collect today 2optout txtauction
0,dude im longer pisc im aquariu
0,got tallent wast
0,let know got money carlo make call
0,lag sad part keep touch thank skype
0,ok anybodi ask abt u tel
0,nice talk pleas dont forget pix want see
0,take care sleep need learn chang need get convinc wait convers convinc famili mani u role life
0,know girl alway safe selfish know got thank good night
0,ok lar doubl check wif da hair dresser alreadi said wun cut v short said cut look nice
