target,text
0,kalli wont bat 2nd inning
1,rington club get uk singl chart mobil week choos top qualiti rington messag free charg
1,2nd attempt contact u u 09071512432 b4 300603t
0,finish lunch alreadi u wake alreadi
0,ok lar joke wif u oni
0,made day great day
0,ok thanx
0,yeah confirm stay weekend
0,k give sec break lt gt cstore
1,urgent mobil number award bonu caller prize call 09058095201 land line valid 12hr
0,pic pleas
0,cant pick phone right pl send messag
0,playin space poker u
0,come friday leav pongal get news work place
0,whatev want know rule talk earlier week start happen show respons yet everi week bend rule way way whatev tire thia argument everi week lt gt movi doesnt inlud preview still get 1
0,hey realli pretti late want go lesson first join reach tp mrt
0,come
0,k k good studi well
0,know lt gt around 5
0,late
0,chk ur belovd ms dict
0,done sorri hope next space give everyth want rememb furnitur around move lock lock leav key jenn
0,slave want take 2 3 pictur today bright light cell phone bright light
0,text get call phone problem
1,1 new voicemail pleas call 08719181513
1,doubl min doubl txt price linerent latest orang bluetooth mobil call mobileupd8 latest offer 08000839402
0,meant calcul lt gt unit lt gt school realli expens start practic accent import decid 4year dental school nmde exam
1,u secret admir look 2 make contact r reveal think ur 09058094565
0,promis take good care princess run pleas send pic get chanc ttyl
0,fp
0,play w comput aiyah tok 2 u lor
1,want funk ur fone weekli new tone repli tones2u 2 text origin n best tone 3gbp network oper rate appli
0,keep ten rs shelf buy two egg
1,congratul thank good friend u xma prize 2 claim easi call 08712103738 10p per minut
0,sorri delay ye master
0,yun ubi one say wan call 67441233 look got ubi cre ubi tech 1st 5wkg
1,hello darl today would love chat dont tell look like sexi
0,yeah sure thing mate haunt got stuff sort im go sound anyway promot hex way dont know number joke
1,congratul winner august prize draw call 09066660100 prize code 2309
0,sef dey laugh meanwhil darl anji
0,pl call da happen
0,yup paragon havent decid whether 2 cut yet hee
0,oh mr sheffield wan na play game okay boss nanni give rais give one
0,meet u work tel shall work tomorrow
0,happi say
0,yup next stop
0,yo call get chanc friend mine want ask big order
0,thank send mental abil question
0,see k
0,fyi gon na call sporad start like lt gt bc doin shit
1,hack chat get backdoor entri 121 chat room fraction cost repli neo69 call 09050280520 subscrib 25p pm dp bcm box 8027 ldn wc1n3xx
0,idp linux system
0,accident delet messag resend pleas
0,whore unbeliev
0,prasanth ettan mother pass away last night pray famili
1,urgent tri contact today draw show prize guarante call 09050001295 land line claim a21 valid 12hr
0,alright omw got ta chang order half8th
0,call ah
0,met stranger choos friend long world stand friendship never end let friend forev gud nitz
1,free camera phone linerent 750 cross ntwk min price txt bundl deal also avbl call 08001950382 mf
0,aaooooright work
0,career tel ad u contact send free sm remov phonebook sm lt gt
0,sindu got job birla soft
1,guarante latest nokia phone 40gb ipod mp3 player prize txt word collect 83355 ibhltd ldnw15h
0,chennai velacheri
1,life never much fun great came made truli special wo forget enjoy one
0,wish great day moji told offer alway speechless offer easili go great length behalf stun exam next friday keep touch sorri
0,want go perumbavoor
0,deep sigh miss realli surpris gone net cafe yet get miss
0,respond
0,cool come like lt gt ish
0,stop stori told return say order
0,tot u outsid co darren say u come shop cours nice wat ju went sim lim look mp3 player
0,ju finish avatar nigro
0,whatev im pretti piss
0,oop shower u call hey park garag collaps univers hospit see crazi stuff like happen
0,aight still want get money
0,anybodi number still thought tact way ask alex
0,good night go sleep
0,oh right make sure load work day got realli nasti cough today dri n shot realli help
0,tot u reach liao said
1,thank rington order ref number k718 mobil charg tone arriv pleas call custom servic 09065069120
0,luv u soo much u donåõt understand special u r 2 ring u 2morrow luv u xxx
0,hmmm mani player select
1,bangbab ur order way u receiv servic msg 2 download ur content u goto wap bangb tv ur mobil menu
0,leav de start prepar next
0,must sit around wait summer day celebr magic sight world dress white oooooh let snow
0,long get repli defer admiss til next semest
1,500 new mobil 2004 must go txt nokia 89545 collect today 2optout txtauction
0,hey mate how u honey u ave good holiday gimmi de goss x
0,u still havent got urself jacket ah
0,cramp stop go back sleep
0,wat time u finish ur lect today
0,dear call
0,ye repli mail go manag offic later plu bank later wednesday
0,u dun wan u dun like alreadi ah wat u still eat
0,u meet fren dun wan meet ah muz b guy rite
1,knock knock txt whose 80082 enter r weekli draw 4 gift voucher 4 store yr choic cs age16
1,today voda number end 7634 select receiv reward match pleas call 08712300220 quot claim code 7684 standard rate appli
0,need drug anymor
0,good afternoon gloriou anniversari day sweet j hope find happi content prey think send teas kiss across sea coax imag fond souveni
0,mm way railway
0,pl pl find aunt nike
0,room number wan na make sure knock right door
0,love daddi make scream pleasur go slap ass dick
0,right brah see later
0,well boy glad g wast night applebe noth
1,great news call freefon 08006344447 claim guarante cash gift speak live oper
0,good afternoon boytoy feel today better hope good boy obedi slave pleas queen
1,well done england get offici poli rington colour flag yer mobil text tone flag 84199 txt eng stop box39822 w111wx
1,repli name address receiv post week complet free accommod variou global locat
0,k 4
0,al moan n e thin goe wrong fault al de argument r fault fed himso bother hav 2go
0,neva mind ok
1,sm auction brand new nokia 7250 4 auction today auction free 2 join take part txt nokia 86021
0,hey almost forgot happi babe love ya
0,noth got msg frm tht unknown
0,reach ur home lt gt minut
0,sound like someth someon test would sayi
0,drug abl eat
0,wake gt
0,co lar ba dao ok 1 pm lor u never ask go ah said u would ask fri said u ask today
0,8 latest g still scroung ammo want give new ak tri
0,aight set free think could text blake address occur quit sure thought
0,pick variou point go 2 yeovil motor project 4 3 hour u take home 12 2 max easi
0,ok bag
0,surpris still guess right lor
0,good need drug
0,printer cool mean groovi wine groovi
0,left alreadi orchard
0,hi kindli give us back document submit loan stapati
1,guess somebodi know secretli fanci wan na find give us call 09065394514 landlin datebox1282essexcm61xn 18
0,realli still tonight babe
1,win newest åòharri potter order phoenix book 5 repli harri answer 5 question chanc first among reader
0,next lt gt hour imma flip shit
0,haha awesom minut
0,ok noth problem
0,look like found someth smoke great job
1,text banneduk 89555 see cost 150p textoper g696ga xxx
1,freemsg txt call 86888 claim reward 3 hour talk time use phone inc 3hr 16 stop txtstop
1,six chanc win cash 100 pound txt csh11 send cost 6day tsandc appli repli hl 4 info
0,ok prob come lunch
0,hey time drive fri go evalu fri
0,sent
1,sunshin quiz wkli q win top soni dvd player u know countri liverpool play mid week txt ansr sp tyron
0,aight plan come later tonight
0,dont make ne plan nxt wknd coz want us come ok
0,messag responc happend
1,2004 account 07xxxxxxxxx show 786 unredeem point claim call 08719181259 identifi code xxxxx expir
0,go chase run cross street
0,day work day except saturday sunday
0,idea
0,sorri free
0,thank gener date brotha
0,aiyo lesson earli still sleepin haha oki u go home liao den confirm w lor
1,forward 21870000 hi mailbox messag sm alert 4 messag 21 match pleas call back 09056242159 retriev messag match
0,sorri call later
0,well must pain catch
0,2 laptop noe infra slow lar wan fast one
0,noth ju tot u would ask co u ba gua went mt faber yest yest ju went alreadi mah today go ju call lor
0,indian r poor india poor countri say one swiss bank director say lt gt lac indian money deposit swiss bank use budget lt gt yr give lt gt crore job indian villag delhi 4 lane road forev free power supli lt gt social project everi citizen get monthli lt gt lt gt yr need world bank amp imf loan think money block rich politician full right corrupt politician itna forward karo ki pura india
0,aight sorri take ten year shower plan
0,ok
0,ye gauti sehwag odi seri
0,plan famili set stone
1,download mani rington u like restrict 1000 2 choos u even send 2 yr buddi txt sir 80082
0,go buy mum present ar
1,well done 4 costa del sol holiday await collect call 09050090044 toclaim sae tc pobox334 stockport sk38xh max10min
0,slept thinkthi time lt gt pm danger
1,ur current 500 pound maxim ur send go 86688 cc 08718720201
0,left yet probabl gon na til dinner
0,hope piss rememb gone sister someth
1,custom servic announc recent tri make deliveri unabl pleas call 07090298926
0,multimedia messag
0,monthli amount terribl pay anyth till 6month finish school
0,velli good ye pleas
0,wondarful song
0,pansi live jungl two year drive worri
0,yup shd haf ard 10 page add figur ìï got mani page
0,seriou like proper tongu
0,dude go sup
1,twink bear scalli skin jock call miss weekend fun call 08712466669 2 stop text call 08712460324 nat rate
0,dont thnk wrong call us
1,win shop spree everi week start 2 play text store skilgm tscs08714740323 1winawk age16
0,babe
0,lol differ go tri find everi real life photo ever took
0,oh ask fun haha take care
0,like shake booti danc floor
1,privat 2003 account statement show 800 point call 08715203694 identifi code 40533 expir
0,would smoke help us work difficult time
0,decid peopl care stuff vote care stuff loser
0,part check iq
0,chikku nt yet ya free
0,live simpl love also simpl laugh simpl win tooo simpl difficult
0,u wear
0,messag great doctor india 1 drink appi fizz contain cancer caus age
1,sm servic inclus text credit pl goto 3qxj9 unsubscrib stop extra charg help 9ae
0,hi darlin im helen fone im gon na b princ 2 nite pleas come tb love kate
0,go good problem still need littl experi understand american custom voic
1,freemsg fav xma tone repli real
0,storm msg wen u lift phne u say u knw wt real mean hello name girl ye u knw dat girl margaret girlfrnd f grahmbel invnt telphon moral one 4get name person
0,peopl see msg think iam addict msging wrong bcoz know iam addict sweet friend bslvyl
0,guess could good excus lol
0,india take lead
0,mm ask come enough
0,india go draw seri mani year south african soil
0,know thing wrong everyso often panick start goin bout bein good enough
0,want snow freez windi
0,phone weirdest auto correct
0,gud ni8 dear slp well take care swt dream muah
0,k need login anyth
0,ladi first genu second k
0,still west coast haiz ìï take forev come back
0,go buy wif meet later
0,home love still awak love kiss
0,also rememb bead come ever
0,alright bring see like lt gt min
0,oi gon na ring
0,money money aint thing sha
0,say hi get ass back south tampa prefer kegger
0,could ask carlo could get anybodi els chip
0,tee hee lectur cheeri bye bye
0,friend studi warwick plan go shop concert tmw may cancel hav seen age yeah get togeth sometim
0,yeah think usual guy still pass last night get ahold anybodi let know throw
0,hamster dead hey tmr meet 1pm orchard mrt
0,gal n boy walk park hold ur hand u think would run away jst wana c feel walk heaven princ gn
0,pl tell nelson bb longer comin money expect aint come
0,come din c yup cut hair
0,dip cell dead come u better respond els shall come back
0,ya referin mei ex wat ah waitin 4 u treat somebodi shld b rich liao gd den u dun work frm tmr onward
0,gibb hussey
0,confirm eat esplanad
0,guy go see movi side
1,ur current 500 pound maxim ur send cash 86688 cc 08708800282
0,k 2marrow come class
0,gloucesterroad uup later
0,agre stop thinkin ipad pleas ask macho question
0,tri make anoth butt
0,eh u send wrongli lar
0,yeah got 2 v apologet n fallen actin like spoilt child got caught till 2 wo go badli cheer
1,congrat 2 mobil 3g videophon r call 09061744553 videochat wid ur mate play java game dload polyh music nolin rentl bx420 ip4 5we 150pm
0,sch neva mind u eat 1st lor
0,gettin bit arti collag mo well tryin 2 ne way got roast min love shall enjoy
0,spoon okay
0,kind miss train co asthma attack nxt one half hr drive sure park
0,r meet
0,rose red red blood blood heart heart u send ti ur friend includ u like u get back r poor relat need 1 support r frnd 2 mani luv u some1 pray god marri tri
0,carlo say mu lt gt minut
0,si lor juz watch italian job
0,dont shall buy one dear
0,mayb fat finger press button know
0,miss call caus yell scrappi miss ca wait u come home lone today
1,urgent 4 costa del sol holiday await collect call 09050090044 toclaim sae tc pobox334 stockport sk38xh max10min
0,boo time u get u suppos take shop today
0,aldrin rakhesh ex rtm
0,book lesson msg call work sth go get spec membership px3748
1,freemsg claim ur 250 sm ok 84025 use web2mobil 2 ur mate etc join c box139 la32wu 16 remov txtx stop
0,join today
0,k k yesterday cbe
0,dear sleep
0,sent part
0,yeah ju rite
0,good even ttyl
1,free entri weekli competit text word win 80086 18 c
0,reach home n bath liao u call
0,solihul want anyth
0,much buzi
1,cash prize claim call09050000327 c rstm sw7 3ss 150ppm
0,dunno let go learn pilat
0,today dedic day song u dedic send ur valuabl frnd first rpli
0,oh yah never cancel leh haha
1,xclusiv clubsaisai 2morow soire special zouk nichol rose 2 ladi info
0,haha dont angri take practic real thing
1,got take 2 take part wrc ralli oz u lucozad energi text ralli le 61200 25p see pack itcould u
0,exactli anyway far jide studi visit
0,lol forgot eh ye bring babe
1,peopl dog area call 09090204448 join like mind guy arrang 1 1 even minapn ls278bb
0,get cash togeth text jason
0,dear good morn feel dear
0,got like lt gt get later though get whatev feel like
0,school start stay weather like food social support system like friend school thing import
0,keep payasam rinu bring
0,k readi lt gt
0,like cheap happi splash wine make feel better
1,u secret admir look 2 make contact r reveal think ur
1,wan na laugh tri mobil logon txting word chat send 8883 cm po box 4217 london w1a 6zf rcvd
0,imagin final get sink bath put pace mayb even eat left also imagin feel cage cock surround bath water remind alway own enjoy cuck
0,ur chang 2 da report big co alreadi made chang 2 da previou report
0,yar lor wan 2 go c hors race today mah eat earlier lor ate chicken rice u
0,affidavit say lt gt e twigg st divis g courtroom lt gt lt time gt doubl check text tomorrow
0,rather promin bite mark right cheek
0,ever green quot ever told jerri cartoon person irrit u alway one love u vri much fail express gud nyt
0,kate
0,still around could use
0,see thought
0,swt thought get tire littl thing 4 lovabl person coz somtim littl thing occupi biggest part heart gud ni8
0,still area restaur ill tri come back soon
1,2nd time tri 2 contact u pound prize 2 claim easi call 087187272008 now1 10p per minut
0,miss ya need ya want ya love ya
0,hey charl sorri late repli
0,hen night go swing
1,winner special select receiv cash award speak live oper claim call cost 10p
0,come day class
0,fuck juswok bed boatin dock slept wid 25 year old spinout giv u da gossip l8r
0,
0,sir hope day go smoothli realli hope wont bother bill ca settl month extra cash know challeng time also let know
0,probabl lt gt
0,mm ye dear look hug
0,add realli care ca least get dude fuck hey money want
0,per request mell oru minnaminungint nurungu vettam set callertun caller press 9 copi friend callertun
0,batteri mr adewal uncl aka egbon
0,pain thought happi toughest thing earth
0,realli need shit tomorrow know wo awak like 6
0,also rememb get dobbi bowl car
0,sister belong 2 famili hope tomorrow pray 4 fate 4 shoranur train incid let hold hand togeth amp fuell love amp concern prior 2 grief amp pain pl join di chain amp pass stop violenc women
0,one power weapon 2 occupi place other
0,ya told ask wat matter
0,lt gt
0,ambrith madurai met u arun dha marrg remembr
0,tmrw im finish 9 door
1,hope enjoy new content text stop 61610 unsubscrib provid
0,hi darlin im missin u hope good time u back time u give call home jess xx
0,miss
0,ummmmmaah mani mani happi return day dear sweet heart happi birthday dear
0,darl sister school resum minimum wait period reappli take care
0,tell pain de
0,u miss someon
0,probabl around mu lot
0,one joy lifei wake daywith thought somewheresomeon care enough tosend warm morn greet
0,yeah go bore depress sittin waitin phone ring hope wind drop though scari
0,well leav class babe never came back hope nice sleep love
0,need say anyth know outsid
0,well know mean text
0,sorri flake last night shit serious goin roommat tonight
0,dont show far put new pictur facebook
0,enufcredeit ileav uni 6 bu yor hous
0,oh k placement ah
0,crazi ar marri ìï like gd look guy fren like say korean leona fave dun thk aft think mayb prob go
0,aathi dear
0,hai ana tomarrow come morn lt decim gt ill sathi go rto offic repli came home
0,nope watch tv home go v bore
0,hey book 2 lesson sun liao
0,lol take member said aunt flow visit 6 month caus develop ovarian cyst bc way shrink
1,urgent tri contact today draw show prize guarante call 09066358361 land line claim y87 valid 12hr
0,pl go ahead watt want sure great weekend abiola
0,cant u tri new invent fli
0,teach app da come colleg
1,4mth half price orang line rental latest camera phone 4 free phone 11mth call mobilesdirect free 08000938767 updat or2stoptxt
0,feb lt gt love day send di ur valu evn 3 come back u gt marri person u luv u ignor di u lose ur luv 4 evr
0,tell happen dont behav like ok need say
0,love start feel need everi time around first thing come would start day end everi time everi breath life happen around life name would cri give happi take readi fight anyon love craziest thing proov anyon girl beauti ladi whole alway sing prais start make chicken curri end maki beauti get everi morn thank god day would like say lot tell later
0,final came fix ceil
0,ìï readi call
0,happi new year u ur famili may new year bring happi stabil tranquil ur vibrant colour life
0,fact leav think addi goe back school tue wed
0,lol know awesom phone could click delet right want
0,yup song bro creativ neva test qualiti said check review onlin
0,av new number wil u use one ta
0,derek done class
0,lol u drunkard hair moment yeah still 4 tonight wat plan
0,yeah get unlimit
1,like tell deepest darkest fantasi call 09094646631 stop text call 08712460324 nat rate
0,lol enjoy role play much
1,tone club sub expir 2 repli monoc 4 mono polyc 4 poli 1 weekli 150p per week txt stop 2 stop msg free stream 0871212025016
0,yeah sure give coupl minut track wallet
0,bu leav lt gt
0,ca speak bcaz mobil problem listen listen voic call later
0,great never better day give even reason thank god
1,83039 uk break accommodationvouch term condit appli 2 claim mustprovid claim number 15541
1,credit top http renew pin tgxxrz
0,dear free messag without recharg hi hi hi
0,wat
1,prize go anoth custom c polo ltd suit 373 london w1j 6hl pleas call back busi
0,reason team budget avail last buy unsold player base rate
0,got divorc lol
0,ye realli great bhaji told kalli best cricket sachin world tough get
0,thinkin someon good drug
0,ranjith cal drpd deeraj deepak 5min hold
0,know yetund sent money yet sent text bother send dont involv anyth impos anyth first place apologis
0,hello yeah got bath need hair come done yeah
0,bull plan go float ikea without care world live mess anoth day
0,pl help tell sura expect batteri hont pl send messag download movi thank
0,scotland hope show jjc tendenc take care live dream
0,sunni california weather cool
0,pleas sen kind advic pleas come tri
0,see
0,eat fo lunch senor
0,e msg ju u said thank gift
0,better still catch let ask sell lt gt
0,yeah get random dude need chang info sheet parti lt gt never studi safe
0,hi love goe day fuck morn woke drop cell way stair seem alright phew miss
0,ga station go
0,go 4 e normal pilat intro
0,juz rememb got ta bath dog today
0,call messag miss call
0,nah man car meant cram full peopl
0,put readi lt time gt
1,ur chanc win cash everi wk txt action c custcar 08712405022
0,got call landlin number ask come anna nagar go afternoon
0,free call sir
0,futur plan tomorrow result today best present enjoy futur
0,alway braini one
0,umma say anyth
0,bishan lei tot say lavend
1,hmv bonu special 500 pound genuin hmv voucher answer 4 easi question play send hmv 86688 info
0,year mani mile
0,thought prap meant anoth one goodo look tomorrow
0,could work reach consensu next meet
0,sorri call later meet
0,pleassssssseeeee tel v avent done sportsx
1,valentin day special win quiz take partner trip lifetim send go 83600 rcvd
0,sent type food like
0,oki wan meet bishan co bishan drive today
0,ok lor
0,babe need advic
0,ìï call dad oredi
0,easi mate guess quick drink bit ambiti
1,get offici england poli rington colour flag yer mobil tonight game text tone flag optout txt eng stop box39822 w111wx
0,right meanwhil project twin comin
0,call number avail appoint ask connect call wahe fathima
0,holi live christ take long
0,bother trust answer pl
0,hey happi birthday
0,dear deni word pleas
0,outsid offic take
0,tire argu week week want
0,manag puzzel
0,leav
0,watch tv got new job
0,congratul ore mo owo wa enjoy wish mani happi moment fro wherev go
0,ah poop look like ill prob send laptop get fix cuz gpu problem
0,absolut love south park recent start watch offic
0,sorri ca help
0,ye care caus know
0,hang brother famili
0,omg could snow tonit
0,use foreign stamp countri
0,busi
0,come correct good look figur
0,hi babe im home wan na someth xx
0,good good job like entrepreneur
0,like new mobil
0,7 wonder world 7th 6th ur style 5th ur smile 4th ur person 3rd ur natur 2nd ur sm 1st love good morn dear
0,told tell stupid hear wont tell anyth dad call brother spoken
0,r mani model soni ericson also der lt gt luk good bt forgot modl
0,happi new year melodi
0,make girl happi difficult make girl happi u need friend companion lover chef lt gt good listen lt gt organ lt gt good boyfriend lt gt clean lt gt sympathet lt gt athlet lt gt warm lt gt courag lt gt determin lt gt true lt gt depend lt gt intellig lt gt psychologist lt gt pest extermin lt gt psychiatrist lt gt healer lt gt stylist lt gt driver aaniy pudunga venaam
0,send resum
0,hey leav big deal take care
0,hmph go head big baller
0,got ga money chanc gang want go grand natur adventur
0,sir late pay rent past month pay lt gt charg felt would inconsider nag someth give great cost didnt speak howev recess wont abl pay charg month henc askin well ahead month end pleas help thank
0,cheer messag zogtoriu iåõv stare phone age decid whether text
0,k u bore come home
0,one teach ship car
0,shuhui bought ron present swatch watch
0,oh fine tonight
1,stop bootydeli invit friend repli see stop send stop frnd 62468
1,sport fan get latest sport news str 2 ur mobil 1 wk free plu free tone txt sport 8007 norm
0,4 oclock mine bash flat plan
0,work ah den 6 plu lor u workin oso rite den go orchard lor place go liao
1,dear voucher holder 2 claim week offer pc go http ts cs stop text txt stop 80062
0,sorri left phone upstair ok might hectic would bird one fell swoop date
0,watch cartoon listen music amp eve go templ amp church u
0,hmmm k want chang field quickli da wan na get system administr network administr
0,aiyar sorri lor forgot 2 tell u
1,wamma get laid want real doggin locat sent direct mobil join uk largest dog network txt dog 69696 nyt ec2a 3lp
0,thank honey great day
0,oh half hour much longer syria canada eh wow must get much work done day us extra time grin
1,congratul thank good friend u xma prize 2 claim easi call 08718726978 10p per minut
0,near kalainar tv
1,urgent mobil number award prize guarante call 09061790126 land line claim valid 12hr 150ppm
0,wat r u
0,well welp sort semiobscur internet thing
1,shop till u drop either 10k 5k cash travel voucher call ntt po box cr01327bt fixedlin cost 150ppm mobil vari
0,ic lol play 9 door sometim yo
0,oki
0,ok lor town lei
0,well pattern emerg friend tell drive come smoke tell weed smoke thing see hesit
0,ok come home
0,alright thank advic enjoy night tri get sleep
0,dun b sad dun thk abt alreadi concentr ur paper k
0,okey dokey bit sort stuff
0,day ask anand number
0,honeybe said sweetest world god laugh amp said wait u havnt met person read msg moral even god crack joke
0,late
0,see swing bit got thing take care firsg
0,peopl mu tabl lambda
0,see forward messag proof
0,dear call accomod
0,ye fine
0,haha hope hear receipt sound gd luck
0,ok care text drive
0,valentin know earli hundr handsom beauti wish thought finish aunti uncl 1st
0,bank say money
0,noth
1,brand new mobil music servic live free music player arriv shortli instal phone brows content top artist
0,think far find check googl map place dorm
0,call make sure dat woken
0,hiya comin 2 bristol 1 st week april le got rudi new yr eve drunk u bak colleg yet work send ink 2 bath
0,u make fb list
0,dont kick coco
0,fine hope good take care
0,black shirt n blue jean thk c
0,medic mission nigeria
1,contract mobil 11 mnth latest motorola nokia etc free doubl min text orang tariff text ye callback remov record
0,tast fish curri
0,suck go u hair free right
0,siva hostel aha
0,hello lover goe new job happi think wake slave send teas kiss across sea
1,want new video phone 600 anytim network min 400 inclus video call download 5 per week free deltomorrow call 08002888812 repli
0,come right ahmad
0,gud mrng dear nice day
0,mean post wrote like mani time ritten stuff let sit feel time angri left hit send stop check phone got car said sleep bore would time clean fold laundri least make bed
0,thank keep mind
0,thought put back box
