target,text
0,everi monday nxt week vl complet
0,oh yeah clearli fault
0,x2 lt gt go get
1,camera award sipix digit camera call 09061221066 fromm landlin deliveri within 28 day
0,ye one woman man pleas tell like dislik bed
1,ever thought live good life perfect partner txt back name age join mobil commun
0,mine like fr china noisi
0,happen
0,dad get back
0,ca keep go never intent run choos rather keep room clean say visitor mayb best choic ye want embarass mayb feel feel friend want drop buy say happen morn tri everyth know els
1,congratul ur award either cd gift voucher free entri 2 weekli draw txt music 87066 tnc
0,time u wrkin
0,wana plan trip sometm
0,wat make peopl dearer de happi dat u feel u meet de pain u feel u miss dem
0,wow v v impress fun shop
0,gim lt gt minut ago
0,wnt buy bmw car urgent vri hv shortag lt gt sourc arng di amt lt gt lac that prob
0,sens foot peni
1,146tf150p
0,lol oop sorri fun
1,want latest video handset 750 anytim network min half price line rental repli call 08000930705 deliveri tomorrow
0,sent score sopha secondari applic school think think appli research cost also contact joke ogunrind school one less expens one
0,call later afternoon onword mtnl servic get problem south mumbai hear listen
0,womdarful actor
0,ye fine love safe
0,wow never realiz embarass accomod thought like sinc best could alway seem happi sorri give sorri offer sorri room embarass
0,u go doctor 4 liver get bit stylish get ur hair manag that
0,either way work lt gt year old hope doesnt bother
0,tension ah machi problem
1,urgent mobil bonu caller prize 2nd attempt reach call 09066362220 asap box97n7qp 150ppm
0,2 student solv cat question lt gt lt gt lt gt tell answer u r brilliant got answr
0,taxt massag argh ok lool
0,might go 2 sch yar e salon v bore
0,well glad find total disagre lol
0,babi promis treat well bet take good care
0,thank better work caus feel use otherwis
0,sure make sure know ai smokin yet
0,busi tri finish new year look forward final meet
0,ju tell u dat b leav 4 shanghai 21st instead haf time 2 meet cya
0,hi hope u r ok said would text u seen let gentli pleas
0,creepi crazi
0,see half hour
0,one good partnership go take lead
0,sent like
1,tri contact offer new video phone 750 anytim network min half price rental camcord call 08000930705 repli deliveri wed
1,check choos babe video fgkslpopw fgkslpo
0,lol hot air balloon
0,help propos go back tomorrow
0,total disappoint text craziest shit got
0,e best 4 ur exam later
0,univers southern california
0,might want pull case plan spend much confid derek taylor money manag
0,start dont stop pray good idea anyth see help guy forward link
0,love give massag use lot babi oil fave posit
0,studi free next weekend
0,great run ttyl
0,bu way calicut
0,want show world princess europ
0,sun cant come earth send luv ray cloud cant come river send luv rain cant come meet u send care msg gud evng
0,think still car
0,yay final lol miss cinema trip last week
0,ìï got wat buy tell us need come
0,leav yet ok lor go elsewher n eat u thk
1,free entri gr8prize wkli comp 4 chanc win latest nokia 8800 psp cash everi great 80878 08715705022
0,depend qualiti want type sent boy fade glori want ralph mayb 2
0,hope good week check
0,ok help ask work tmr
0,messag truro hospit ext phone phone side
0,btw regard realli tri see anyon els 4th guy commit random dude
0,thanx lot
0,east coast
0,like lt gt question
0,ye obvious potato speak soon
0,aslamalaikkum insha allah tohar beeen muht albi mufti mahfuuz mean
0,oh realli make air talent
0,everywher dirt floor window even shirt sometim open mouth come flow dream world without half chore time joy lot tv show see guess like thing must exist like rain hail mist time done becom one
0,good time nice someth bit differ weekend chang see ya soon
0,well good morn mr how london treatin ya treacl
0,good morn pooki pie lol hope wake u
1,think ur smart win week weekli quiz text play 85222 cs winnersclub po box 84 m26 3uz
1,nokia 7250i get win free auction take part send nokia 86021
0,ticket 4 walsal tue 6 th march mate get sat ill pay treat want 2 go txt bak
0,oh ho first time u use type word
0,thk 50 shd ok said plu minu 10 leav line paragraph
0,yo guess drop
0,oh yeah diet flew window
0,twenti past five said train durham alreadi coz reserv seat
0,aight work thank
0,take care n get well soon
0,let use next week princess
0,cbe realli good nowaday lot shop showroom citi shape good
0,well obvious peopl cool colleg life went home
0,go write ccna exam week
0,alway make thing bigger
0,yeah got one line us
0,fran decid 2 go n e way im complet broke knacker got bout 3 c u 2mrw love janx dad fone credit
0,still chanc search hard get let tri
0,happi new year princess
0,like
0,hope great new semest wish best made great
0,way ur home
1,urgent tri contact today draw show prize guarante call 09050003091 land line claim c52 valid12hr
0,oh ok
0,1 reach home call
0,monday next week give full gist
0,come room point iron plan weekend
0,oh oh wast den muz chiong sat n sun liao
0,jane babe goin 2 wrk feel ill lst nite fone alreadi cover 4 chuck
0,haiyoh mayb hamster jealou million
0,play one day last year know even though good team like india
1,dear 0776xxxxxxx u invit xchat final attempt contact u txt chat 86688 ldn 18yr
0,anytim lor
0,made eta taunton plan hope still okday good see
0,dnt worri use ice piec cloth take 2 tablet
0,oh phone phone disconnect
0,yo howz u girl never rang india l
0,plural noun research
0,hi happi birthday hi hi hi hi hi hi hi
0,see ca see mayb reboot ym seen buzz
0,time week ryan
0,guess
0,sorri didntgiv ya bellearli hunni
0,pleas ask macho price rang want someth new use plu interfu blackberri bold lt gt bb
0,pl send compani name saibaba colani
0,look fri pan case cheap book perhap silli fri pan like book
0,yup bath liao
0,telli brdget jone
0,wan na gym
0,mum repent
1,repli win weekli profession sport tiger wood play send stop 87239 end servic
0,project w fren lor
0,forc eat slice realli hungri tho suck mark get worri know sick turn pizza lol
0,im fine babe aint 2 much tho saw scari movi yest quit funni want 2mrw afternoon town mall sumthin xx
0,thank love torch bold
0,babe talk think good boy miss love
0,ay wana meet sat wkg sat
0,naughti littl thought better flirt flirt n flirt rather love someon n gettin hurt hurt n hurt gud nyt
0,dear reach room
0,pl send comprehens mail pay much
0,aiyah e rain like quit big leh drizzl least run home
0,worri hope photo shoot went well spif fun workag
0,repli boy chang phone number
0,yar els thk sort funni thing
1,2nd time tri 2 contact u 750 pound prize 2 claim easi call 08712101358 10p per min
0,actual first time went bed long spoke woke night
0,haf enuff space got like 4 mb
0,thanx
0,hi hope u get hasnt gd 50 min late think
0,great princess think
0,hi juan im come home fri hey cours expect welcom parti lot present ill phone u get back load love nicki x x x x x x x x x
1,okmail dear dave final notic collect 4 tenerif holiday 5000 cash award call 09061743806 landlin tc sae box326 cw25wx 150ppm
1,urgent tri contact last weekend draw show prize guarante call claim code k61 valid 12hour
0,eek lot time especi sinc american pie like 8 minut long ca stop sing
0,ok ill send lt decim gt ok
0,sell ton coin sell coin someon thru paypal voila money back life pocket
0,wana fal luv vth book bed fal luv vth yen madodu nav pretsorginta nammanna pretsovru import alwa gud
0,said text one time
0,hi wkend ok journey terribl wk good huge back log mark
0,god ask forgiv littl child gave love repli
0,u fix teeth take care
0,got ur mail muchand look forward lot support less contact rememb one venugop late shall tri come till dear
0,u got person stori
1,privat 2003 account statement 07815296484 show 800 point call 08718738001 identifi code 41782 expir
1,chase us sinc sept definit pay thank inform ignor kath manchest
0,part understand
0,dear reach
0,howz come said medicin
0,edison rightli said fool ask question wise man know us speechless viva gm
0,u call lunch
0,haha friend tyler liter ask could get dubsack
1,want 750 anytim network min 150 text new video phone five pound per week call 08000776320 repli deliveri tomorrow
0,cal sir meet
0,hi harish rent transfr ur acnt
0,type stuff sing
1,ur balanc next question complet landmark big bob barri ben text b c good luck
0,thank babi cant wait tast real thing
0,back good journey let know need receipt shall tell like pendent
0,tht wat wright brother fli
0,text finish long time ago shower
0,great hear settl well happenin wit ola
0,ard 6 like dat lor
1,sexi singl wait text age follow gender wither f gay men text age follow
0,huh mean comput scienc like dat one push n
0,hope text meet smile let text give reason smile beauti day
1,free messag activ 500 free text messag repli messag word free term condit visit
0,onlin transact
0,alright took morphin back yo
0,arestaur eat squid wan na dosometh late
0,playng 9 door game gt race phone lol
0,hmm mani unfortun pic obvious arent hot cake kinda fun tho
0,sorri join leagu peopl dont keep touch mean great deal friend time even great person cost great
0,also chat awesom make regular unless see person
0,good morn princess
0,pl clarifi back open return ticket prepon go back kerala
1,welcom msg free give free call futur mg bill 150p daili cancel send 89123
0,even u dont get troubl convinc tel twice tel neglect msg dont c read dont repli
1,monthli password wap use wap phone pc
0,arm fine cardiff uni
0,yup anyth lor u dun wan ok
0,get ok
0,know friend alreadi told
0,feel real valentin yo valentin even tho u hardli play
1,great new offer doubl min doubl txt best orang tariff get latest camera phone 4 free call mobileupd8 free 08000839402 2stoptxt cs
0,squeeeeez christma hug u lik frndshp den hug back u get 3 u r cute 6 u r luvd 9 u r lucki none peopl hate u
0,u r much close heart u go away shatter plz stay
0,lol pleas actual send pic right wan na see pose comb hair dryer someth
0,tri g decid head
0,alway say welp
0,that cool want pleas
1,ur balanc ur next question sang girl 80 2 answer txt ur answer good luck
0,channel
0,eat jap done oso aft ur lect wat ìï got lect 12 rite
0,gentl babi soon take lt gt inch deep insid tight pussi
0,ha us e thing got tv 2 watch u thk 2 go tonight u alreadi haf smth mind
0,good morn repair shop reason hour
0,much fight good nite
0,guess lt gt min
1,jamster get free wallpap text heart 88888 c appli 16 need help call 08701213186
0,drive train
0,come guoyang go n tell u told
0,glad went well come 11 plenti time clair goe work
0,match lt gt 2
0,eh den sat u book e kb liao huh
0,revers cheat mathemat
1,free rington text first 87131 poli text get 87131 true tone help 0845 2814032 16 1st free tone txt stop
0,
1,want new video phone 750 anytim network min half price line rental free text 3 month repli call 08000930705 free deliveri
1,heard u4 call 4 rude chat privat line 01223585334 cum wan 2c pic gettin shag text pix 8552 2end send stop 8552 sam xxx
0,dice art class 6 thru 9 thank though idea time come tomorrow
1,privat 2003 account statement fone show 800 point call 08715203656 identifi code 42049 expir
0,bad girl ladi
0,serious spell name
0,hi hope good day better night
0,open rebtel firefox load put plu sign user name place show two number lower number number pick number pin display okay
0,live simpl love also simpl laugh simpl win tooo simpl difficult gud nte
0,u drive lor
0,like made throw smoke friend car one time awesom
0,good r u work
0,haha kid papa need drug
0,long take get
0,yar tot u knew di would happen long ago alreadi
0,lor
1,urgent ur award complimentari trip eurodisinc trav aco entry41 claim txt di 87121 morefrmmob shracomorsglsuplt 10 ls1 3aj
0,today go colleg abl atten class
0,yeah gang readi
0,hey free call
0,hello damn christma thing think decid keep mp3 doesnt work
0,sorri chikku cell got problem tht nt abl repli u msg u
1,2nd time tri contact u prize claim call 09053750005 b4 sm 08718725756 140ppm
0,thank say happi onam fine rememb met insur qatar insha ex tata aig join tissco tayseer
0,honeymoon outfit
0,hmm bad news hype park plaza 700 studio taken left 2 900
0,wot u 2 j
0,laid airtel line rest
0,fren go lor alon wif mum n si lor
0,im gonnamissu much would say il send u postcard butther abouta much chanc merememberin asther ofsi breakin contract luv yaxx
0,forgot tell smth like number section clearer
1,buy space invad 4 chanc 2 win orig arcad game consol press 0 game arcad std wap charg see 4 term set purchas
0,great hope like man well endow lt gt inch
1,1 polyphon tone 4 ur mob everi week txt pt2 87575 1st tone free get txtin tell ur friend 16 repli hl 4info
0,night night see tomorrow
0,today sorri ever angri ever misbehav hurt plz plz slap urself bcoz ur fault basic good
0,nutter cutter ctter cttergg cttargg ctargg ctagg ie
0,mean websit ye
0,lol ok rememb til last nite
0,ye u text pshew miss much
1,urgent mobil award bonu caller prize final tri contact u call landlin 09064019788 box42wr29c 150ppm
0,yavnt tri yet never play origin either
0,take someth pain move howev side next 6hr see doctor
0,great offic today
0,buy one egg da pleas
0,good morn plz call sir
0,mile smile r made frm letter u know differ smile ur face keep happi even though mile away u keep smile good nyt
0,take exam march 3
0,hi kate u give ring asap xxx
0,nah im goin 2 wrk j wot bout u
0,dont knw pa drink milk
0,wot u wan na missi
0,wat time finish
0,okay thought expert
0,compliment away system side
0,sen told go join uncl financ cbe
0,ok stay night xavier sleep bag get tire
0,hello love went day alright think sweet send jolt heart remind love hear scream across sea world hear ahmad al hallaq love own possess passion kiss
0,fwiw reason around time smoke ga afford around someon tell appar happen somebodi want light
0,wont wat wit guy
0,noooooooo pleas last thing need stress life fair
0,wait machan call free
1,1 new messag call
0,yo around friend mine lookin pick later tonight
0,appar bff carli quick
0,im reali soz imat mum 2nite 2moro
0,night end anoth day morn come special way may smile like sunni ray leav worri blue blue bay gud mrng
1,fanci shag txt xxuk suzi txt cost per msg tnc websit x
0,send new number
1,mobil 11 month u r entitl updat latest colour mobil camera free call mobil updat co free 08002986030
0,abj serv stay dad alon
0,went project centr
0,yeah probabl earlier
0,back bit long co accid a30 divert via brilliant weekend thank speak soon lot love
0,probabl gon na see later tonight lt
0,alreadi back home probabl
0,ye innoc fun
0,ye complet form clark also utter wast
0,case guess see campu lodg
0,lt gt great loxahatche xma tree burn updat total see star
0,usual take fifteen fuck minut respond ye question
0,hey angri repli dr
1,urgent mobil 07808726822 award bonu caller prize 2nd attempt contact call box95qu
0,will go aptitud class
0,wait call sir
0,thought get watch co that kind thing u get4an18th love much
0,1 go write msg 2 put dictionari mode 3 cover screen hand 4 press lt gt 5 gentli remov ur hand interest
0,vote wherev heart guid
0,aight time want come
0,plz note anyon call mobil amp ask u type lt gt lt gt disconnect call coz iz attempt make use sim card itz confirmd nokia n motorola n verifi cnn ibn
0,merri christma u anni
0,boo thing back home littl bore alreadi
0,ok prob take ur time
0,webpag avail
0,dear take care reach u lot
0,ye last practic
0,v nice 2 sheffield tom 2 air opinion categori 2 b use 2 measur ethnic next censu busi transcrib
0,go film 2day da 6pm sorri da
0,daddi shu shu look 4 u u wan 2 tell u singapor wat
1,xma reward wait comput randomli pick loyal mobil custom receiv reward call 09066380611
1,urgent tri contact last weekend draw show prize guarante call claim code s89 valid 12hr
0,si catch e show e afternoon watch w c u wan 2 watch today tmr lor
0,sleep surf
0,forgotten might coupl buck send tomorrow k love ya
0,geeee miss alreadi know think fuck ca wait till next year togeth love kiss
0,ye dont care need bad princess
0,busi come point figur tomorrow
0,lol ye add spice day
1,wml c ringtoneåá
0,yup remb think book
0,know serv mean
0,funni fact nobodi teach volcano 2 erupt tsunami 2 aris hurrican 2 sway aroundn 1 teach hw 2 choos wife natur disast happen
0,usual bodi take care buy make sure doesnt progress pl continu talk saturday
0,home doc gave pain med say everyth fine
0,yeah lol luckili star role like
0,take us shop mark distract
0,r u sam p eachoth meet go 2 hous
1,urgent call 09066350750 landlin complimentari 4 ibiza holiday cash await collect sae cs po box 434 sk3 8wp 150 ppm
0,pleas come imin urgoin outl8r
0,take derek amp taylor walmart back time done leav mous desk text priscilla readi
0,much u tri get
0,goodmorn today late lt decim gt min
0,someon year lt gt toyota camri like mr olayiwola mileag lt gt clean need know much sell rais dough soon land sell holla back
0,also cbe pay
0,check room befor activ
0,daddi take good care
0,whatsup dont u want sleep
0,ok
0,callin say hi take care bruv
0,suck got plan yo valentin yo valentin
0,ye nigh cant aha
1,mobi pub high street prize u know new duchess cornwal txt first name stop 008704050406 sp arrow
0,eat shit wait ur monkey face bitch u asshol
0,cocksuck make feel better ipad worthless garbag novelti item feel bad even want one
0,darlin youphon im athom youwanna
0,know god creat gap finger one made come amp fill gap hold hand love
0,good movi ok leav hourish
0,lmao know well
0,alright head minut text meet
0,yeah thought lem know anyth goin later
1,doubl min txt orang price linerent motorola sonyericsson free call mobileupd8 08000839402
0,book ticket pongal
0,tell who pl
1,decemb mobil entitl updat latest colour camera mobil free call mobil updat vco free 08002986906
0,
1,kit strip bill 150p netcollex po box 1013 ig11 oja
0,break time one come n get stuff fr
0,probabl wo eat today think gon na pop weekend u miss
0,ok lor go tog lor
1,congrat 1 year special cinema pass 2 call 09061209465 c suprman v matrix3 starwars3 etc 4 free 150pm dont miss
0,meet lobbi
0,want come onlin
0,go noth
0,ron say fri leh n said ding tai feng cant make reserv said wait lor
0,ha would say read anyth way u seem like 2 judgement save friday pub
0,dunno lei like dun haf
0,yeah quit bit left swing tomorrow get
1,spook mob halloween collect logo pic messag plu free eeri tone txt card spook 8007 zed 08701417012150p per
0,sorri light turn green meant anoth friend want lt gt worth may around
0,ye mani sweet
0,u still plumber tape wrench could borrow
0,haha mayb u rite u know well da feel like someon gd lor u faster go find one gal group attach liao
1,come take littl time child afraid dark becom teenag want stay night
0,hear loud scream lt gt minut caus gyno shove thing belong
0,hmm think lor
1,valu custom pleas advis follow recent review mob award bonu prize call 09066368470
0,hate turn fun shop trip annoy day everyth would look hous
0,lara said loan lt gt
1,pleas call amanda regard renew upgrad current handset free charg offer end today tel 0845 021 3680 subject c
1,forward 21870000 hi mailbox messag sm alert 40 match pleas call back 09056242159 retriev messag match
0,dude u knw also telugu tht gud k gud nyt
0,know mallika sherawat yesterday find lt url gt
0,hi mate rv u hav nice hol messag 3 say hello coz havenåõt sent u 1 age start drive stay road rvx
0,didnt get ur full msg sometext miss send
0,way offic da
0,come get b quit diff guess rite
0,happi new year man
0,night worri appt shame miss girl night quizz popcorn hair
0,need lar ju test e phone card dunno network gd thk wait 4 si 2 finish bath bath dun disturb u liao u clean ur room
1,guarante cash claim yr prize call custom servic repres
0,good find way
0,thank honey still heard anyth leav bit longer 2 crowd tri later great advic thank hope cardiff still
0,ye thought thank
0,ok chikku 1 favourit song
0,ok thanx take care
0,ooh 4got gon na start belli danc moseley wed u want 2 join cafe
0,dunno lei might b eatin wif fren wan eat wait 4 lar
0,ok lar u sleep earli nite
1,3 free tarot text find love life tri 3 free text chanc 85555 16 3 free msg
0,yeah leav coupl minut amp let know get mu
0,buy blackberri bold 2 torch buy new use let know plu say buy lt gt g wifi ipad say lt gt g
1,congratul u claim 2 vip row ticket 2 c blu concert novemb blu gift guarante call 09061104276 claim ts cs
0,waaaat lololo ok next time
1,want explicit sex 30 sec ring 02073162414 cost
1,call 09095350301 send girl erot ecstaci stop text call 08712460324 nat rate
0,pick receipt someth earlier
0,otherwis part time job
0,ye pleas swim
0,well uv caus mutat sunscreen like essenti theseday
1,freemsg hey u got 1 fone repli wild txt ill send u pic hurri im bore work xxx 18 stop2stop
0,see requir pleas
0,respond imma assum still asleep imma start call n shit
0,much eighth
0,haha dinner cousin
0,u come back 4 dinner rite dad ask confirm wif u
0,lol tri make day littl interest
0,haha yup hope lose kg mon hip hop go orchard weigh
0,height confid aeronaut professor wer calld amp wer askd 2 sit aeroplan aftr sat wer told dat plane ws made student dey hurri plane bt 1 didnt move said made student
0,what come hill monster hope great day thing r go fine busi though
0,u horribl gal u knew dat go wif yest n u still come n ask
0,work go min
0,like hotel dusk game think solv puzzl area thing
0,omg make wed chapel frontiervil get good stuff
0,u wan 2 haf lunch da canteen
1,uniqu user id remov send stop 87239 custom servic 08708034412
0,hi yiju regard 3230 textbook intro algorithm second edit sell 50
1,ur chanc win cash everi wk txt action c custcar 08712405022
1,freemsg feelin kinda lnli hope u like 2 keep compani jst got cam mobi wan na c pic txt repli date 82242 msg150p 2rcv hlp 08712317606 stop 82242
0,nobodi name peni girl name stori add
0,g class earli tomorrow thu tri smoke lt gt
0,yeah prob last night obvious catch speak soon
0,hai priya right doctor said
0,ard 530 like dat lor juz meet mrt station dun haf come
0,mmmmmmm snuggl deep content sigh whisper fuck love much bare stand
0,worri easi ingredi
0,love cuddl want hold strong arm right
0,xy ur car u pick
0,detroit home snow enjoy
0,call get chanc plz lt 3
0,enjoy watch play footbal basketbal anyth outdoor
0,accident brought em home box
0,happen r 2waxsto wat want come ill get medic insur abl deliv basic care current shop right medic insur give til friday morn that see major person guid right insur
0,yeah probabl still got ta check leo
1,england v macedonia dont miss news txt ur nation team 87077 eg england 87077 tri wale scotland poboxox36504w45wq
1,u subscrib best mobil content servic uk per 10 day send stop helplin 08706091795
0,hope alright babe worri might felt bit despar learn job fake wait come back love
0,sent email address incomm right
0,hope ur head hurt 2 much plough way pile iron stay chinki tonight come round like
0,spend day wait ideal path appear front us forget made walk wait goodnight
0,later show around want cld drink wld prefer spend money nosh mind nxt wk
0,realli sorri lit hair fire
0,love aathi love u lot
0,go ride bike
0,k k sm chat
0,go sao mu today done 12
0,sorri meet call later
0,hmm ok stay like hour co eye realli sore
0,go 4 lunch wif famili aft dat go str 2 orchard lor
0,idc get weasel way shit twice row
0,ju chillaxin
1,get free mobil video player free movi collect text go free extra film order c appli 18 yr
0,okay chase dream good next
1,warner villag 83118 c colin farrel swat wkend warner villag get 1 free med popcorn show c c kiosk repli soni 4 mre film offer
0,ìï still attend da talk
0,sorri vikki watch olav mandara movi kano trishul theatr wit frnd
0,possibl
1,u secret admir look 2 make contact r reveal think ur 09058094599
0,got call tool
0,get headach tri figur u trust math promis
0,sound gd haha wah u yan jiu fast liao
0,need stop go bed make fuck deal
0,well done luv ya
0,uncl atlanta wish guy great semest
0,lol ok ill tri send warn sprint dead slow prolli get tomorrow
0,yeah stand close catch someth
0,mani happi return day wish happi birthday
0,goodmorn sleep ga
0,ye said
1,marri local women look discreet action 5 real match instantli phone text match 69969 msg cost 150p 2 stop txt stop bcmsfwc1n3xx
1,today offer claim ur worth discount voucher text ye 85023 savamob member offer mobil cs sub 16 unsub repli x
0,go tell friend sure want live smoke much spend hour beg come smoke
0,came hostel go sleep plz call class hrishi
0,ur physic get
0,bloo bloo bloo miss first bowl
0,taka lor wat time u wan 2 come n look 4 us
0,ok lor thanx ìï school
0,faith make thing possibl hope make thing work love make thing beauti may three christma merri christma
1,natalja invit friend repli see stop send stop frnd 62468
1,congratul ur award 500 cd voucher 125gift guarante free entri 2 100 wkli draw txt music 87066 tnc
0,fuck cedar key fuck come anyway tho
0,sorri da today wont come play drive cla
0,argh 3g spotti anyway thing rememb research provinc sterl place look
0,hai dear friend new amp present number rajitha raj ranju
0,love excit day spend make happi
0,knew time murder exactli
1,send logo 2 ur lover 2 name join heart txt love name1 name2 mobno eg love adam eve 07123456789 87077 yahoo pobox36504w45wq txtno 4 ad 150p
0,know lack particular dramastorm detail part worri
0,yoyyooo u know chang permiss drive mac usb flash drive
0,also bring galileo dobbi
0,gon na get rimac access
0,way home long dri spell season would
0,anyth lor u decid
0,hhahhaahahah rofl wtf nig leonardo room someth
0,yep derek hous see sunday lt 3
0,suppos meet discuss abt trip thought xuhui told afternoon thought go lesson
0,play smash bro lt gt religi
0,great trip india bring light everyon project everyon lucki see smile bye abiola
1,guarante cash prize claim yr prize call custom servic repres 08714712412 cost 10p
0,u reckon need 2 arrang transport u ca thank
1,special select receiv 2000 pound award call 08712402050 line close cost 10ppm cs appli ag promo
1,bore housew chat n date rate landlin
0,come back thursday yay gon na ok get money cheer oh yeah everyth alright how school call work
